id,title,slug,category,source_page,expected_filename,search_query_suggestion
652,CARACOLAS DE PAVO CON YUCA FRITA,caracolas-de-pavo-con-yuca-frita,Carnes y aves,959,0652-caracolas-de-pavo-con-yuca-frita.webp,CARACOLAS DE PAVO CON YUCA FRITA receta foto
653,POLLO AL CURRY CON ARROZ BASMATI,pollo-al-curry-con-arroz-basmati,Carnes y aves,960,0653-pollo-al-curry-con-arroz-basmati.webp,POLLO AL CURRY CON ARROZ BASMATI receta foto
654,MAGRET DE PATO MECHADO CON FRUTAS Y ARROZ SALVAJE,magret-de-pato-mechado-con-frutas-y-arroz-salvaje,Carnes y aves,962,0654-magret-de-pato-mechado-con-frutas-y-arroz-salvaje.webp,MAGRET DE PATO MECHADO CON FRUTAS Y ARROZ SALVAJE receta foto
655,CONFIT DE PATO CON PURÉ DE MANZANA Y CALABACÍN,confit-de-pato-con-pure-de-manzana-y-calabacin,Carnes y aves,963,0655-confit-de-pato-con-pure-de-manzana-y-calabacin.webp,CONFIT DE PATO CON PURÉ DE MANZANA Y CALABACÍN receta foto
658,ATADITO DE POLLO AL OPORTO,atadito-de-pollo-al-oporto,Carnes y aves,968,0658-atadito-de-pollo-al-oporto.webp,ATADITO DE POLLO AL OPORTO receta foto
659,FILETES DE POLLO RELLENOS DE JAMÓN Y QUESO,filetes-de-pollo-rellenos-de-jamon-y-queso,Carnes y aves,969,0659-filetes-de-pollo-rellenos-de-jamon-y-queso.webp,FILETES DE POLLO RELLENOS DE JAMÓN Y QUESO receta foto
660,PATO CON ARÁNDANOS Y CHIPS DE BONIATO,pato-con-arandanos-y-chips-de-boniato,Carnes y aves,970,0660-pato-con-arandanos-y-chips-de-boniato.webp,PATO CON ARÁNDANOS Y CHIPS DE BONIATO receta foto
661,CINTAS DE POLLO EMPANADO CON TOMATE ESPECIADO,cintas-de-pollo-empanado-con-tomate-especiado,Carnes y aves,971,0661-cintas-de-pollo-empanado-con-tomate-especiado.webp,CINTAS DE POLLO EMPANADO CON TOMATE ESPECIADO receta foto
664,POPIETAS DE PAVO CON PATATAS FRITAS,popietas-de-pavo-con-patatas-fritas,Carnes y aves,977,0664-popietas-de-pavo-con-patatas-fritas.webp,POPIETAS DE PAVO CON PATATAS FRITAS receta foto
665,RULOS DE PAVO EMPANADOS CON TOMATES CHERRY,rulos-de-pavo-empanados-con-tomates-cherry,Carnes y aves,978,0665-rulos-de-pavo-empanados-con-tomates-cherry.webp,RULOS DE PAVO EMPANADOS CON TOMATES CHERRY receta foto
666,ALITAS DE POLLO CON PATATAS Y SETAS,alitas-de-pollo-con-patatas-y-setas,Carnes y aves,978,0666-alitas-de-pollo-con-patatas-y-setas.webp,ALITAS DE POLLO CON PATATAS Y SETAS receta foto
667,CODORNICES EN SALSA DE ARÁNDANOS CON ARROZ SALVAJE,codornices-en-salsa-de-arandanos-con-arroz-salvaje,Carnes y aves,979,0667-codornices-en-salsa-de-arandanos-con-arroz-salvaje.webp,CODORNICES EN SALSA DE ARÁNDANOS CON ARROZ SALVAJE receta foto
670,POLLO RUSTIDO CON CIRUELAS,pollo-rustido-con-ciruelas,Carnes y aves,985,0670-pollo-rustido-con-ciruelas.webp,POLLO RUSTIDO CON CIRUELAS receta foto
671,POLLO GUISADO,pollo-guisado,Carnes y aves,986,0671-pollo-guisado.webp,POLLO GUISADO receta foto
672,PERDICES EN ESCABECHE,perdices-en-escabeche,Carnes y aves,987,0672-perdices-en-escabeche.webp,PERDICES EN ESCABECHE receta foto
673,CONFIT DE PATO CON SALSA DE ARÁNDANOS,confit-de-pato-con-salsa-de-arandanos,Carnes y aves,988,0673-confit-de-pato-con-salsa-de-arandanos.webp,CONFIT DE PATO CON SALSA DE ARÁNDANOS receta foto
676,PASTEL DE POLLO,pastel-de-pollo,Carnes y aves,994,0676-pastel-de-pollo.webp,PASTEL DE POLLO receta foto
677,PECHUGA DE PAVO CON CEBOLLA CARAMELIZADA,pechuga-de-pavo-con-cebolla-caramelizada,Carnes y aves,995,0677-pechuga-de-pavo-con-cebolla-caramelizada.webp,PECHUGA DE PAVO CON CEBOLLA CARAMELIZADA receta foto
678,MUSLOS DE PAVO ASADOS,muslos-de-pavo-asados,Carnes y aves,996,0678-muslos-de-pavo-asados.webp,MUSLOS DE PAVO ASADOS receta foto
679,CODORNICES ASADAS CON PATATAS Y PIMIENTOS,codornices-asadas-con-patatas-y-pimientos,Carnes y aves,996,0679-codornices-asadas-con-patatas-y-pimientos.webp,CODORNICES ASADAS CON PATATAS Y PIMIENTOS receta foto
682,PAVO MECHADO CON MANZANA ASADA,pavo-mechado-con-manzana-asada,Carnes y aves,1002,0682-pavo-mechado-con-manzana-asada.webp,PAVO MECHADO CON MANZANA ASADA receta foto
683,AJÍ DE GALLINA,aji-de-gallina,Carnes y aves,1003,0683-aji-de-gallina.webp,AJÍ DE GALLINA receta foto
684,CINTAS DE CARNE CON UVAS Y BONIATOS PAJA,cintas-de-carne-con-uvas-y-boniatos-paja,Carnes y aves,1004,0684-cintas-de-carne-con-uvas-y-boniatos-paja.webp,CINTAS DE CARNE CON UVAS Y BONIATOS PAJA receta foto
685,GUISO DE POLLO CON PATATAS Y ARROZ,guiso-de-pollo-con-patatas-y-arroz,Carnes y aves,1005,0685-guiso-de-pollo-con-patatas-y-arroz.webp,GUISO DE POLLO CON PATATAS Y ARROZ receta foto
688,SECRETARIA ALCALAÍNA,secretaria-alcalaina,Carnes y aves,1010,0688-secretaria-alcalaina.webp,SECRETARIA ALCALAÍNA receta foto
689,MENESTRA DE POLLO,menestra-de-pollo,Carnes y aves,1011,0689-menestra-de-pollo.webp,MENESTRA DE POLLO receta foto
690,"SANJACOBOS DE POLLO, JAMÓN Y QUESO",sanjacobos-de-pollo-jamon-y-queso,Carnes y aves,1012,0690-sanjacobos-de-pollo-jamon-y-queso.webp,"SANJACOBOS DE POLLO, JAMÓN Y QUESO receta foto"
691,PALETILLAS DE CONEJO CON SETAS A LA MOSTAZA,paletillas-de-conejo-con-setas-a-la-mostaza,Carnes y aves,1014,0691-paletillas-de-conejo-con-setas-a-la-mostaza.webp,PALETILLAS DE CONEJO CON SETAS A LA MOSTAZA receta foto
693,LOMOS DE RAPE CON PANCETA Y CREMA DE LECHUGA,lomos-de-rape-con-panceta-y-crema-de-lechuga,"Pescados, mariscos y moluscos",1020,0693-lomos-de-rape-con-panceta-y-crema-de-lechuga.webp,LOMOS DE RAPE CON PANCETA Y CREMA DE LECHUGA receta foto
694,MERLUZA CON PANADERAS Y PIQUILLOS,merluza-con-panaderas-y-piquillos,"Pescados, mariscos y moluscos",1021,0694-merluza-con-panaderas-y-piquillos.webp,MERLUZA CON PANADERAS Y PIQUILLOS receta foto
696,LUBINA RELLENA CON SALSA AMERICANA,lubina-rellena-con-salsa-americana,"Pescados, mariscos y moluscos",1024,0696-lubina-rellena-con-salsa-americana.webp,LUBINA RELLENA CON SALSA AMERICANA receta foto
698,TATAKI DE BONITO,tataki-de-bonito,"Pescados, mariscos y moluscos",1026,0698-tataki-de-bonito.webp,TATAKI DE BONITO receta foto
699,POPIETAS DE LENGUADO CON SALSA DE CAVA Y GELATINA DE MEJILLONES,popietas-de-lenguado-con-salsa-de-cava-y-gelatina-de-mejillones,"Pescados, mariscos y moluscos",1029,0699-popietas-de-lenguado-con-salsa-de-cava-y-gelatina-de-mejillones.webp,POPIETAS DE LENGUADO CON SALSA DE CAVA Y GELATINA DE MEJILLONES receta foto
700,KOKOTXAS DOS GUSTOS CON ARROZ FRITO,kokotxas-dos-gustos-con-arroz-frito,"Pescados, mariscos y moluscos",1030,0700-kokotxas-dos-gustos-con-arroz-frito.webp,KOKOTXAS DOS GUSTOS CON ARROZ FRITO receta foto
703,SEPIA EN SALSA CON CUSCÚS,sepia-en-salsa-con-cuscus,"Pescados, mariscos y moluscos",1036,0703-sepia-en-salsa-con-cuscus.webp,SEPIA EN SALSA CON CUSCÚS receta foto
704,MARIPOSAS DE SALMÓN CON VERDURAS,mariposas-de-salmon-con-verduras,"Pescados, mariscos y moluscos",1037,0704-mariposas-de-salmon-con-verduras.webp,MARIPOSAS DE SALMÓN CON VERDURAS receta foto
705,PULPO CON ALIOLI DE FRUTAS,pulpo-con-alioli-de-frutas,"Pescados, mariscos y moluscos",1038,0705-pulpo-con-alioli-de-frutas.webp,PULPO CON ALIOLI DE FRUTAS receta foto
706,PAPILLOTE DE SALMONETES,papillote-de-salmonetes,"Pescados, mariscos y moluscos",1039,0706-papillote-de-salmonetes.webp,PAPILLOTE DE SALMONETES receta foto
709,BROCHETA DE BONITO CON SALSA DE ÑORAS Y NECTARINAS,brocheta-de-bonito-con-salsa-de-noras-y-nectarinas,"Pescados, mariscos y moluscos",1043,0709-brocheta-de-bonito-con-salsa-de-noras-y-nectarinas.webp,BROCHETA DE BONITO CON SALSA DE ÑORAS Y NECTARINAS receta foto
710,MONTADITOS DE GALLO Y CALABACÍN CON TOMATE,montaditos-de-gallo-y-calabacin-con-tomate,"Pescados, mariscos y moluscos",1044,0710-montaditos-de-gallo-y-calabacin-con-tomate.webp,MONTADITOS DE GALLO Y CALABACÍN CON TOMATE receta foto
711,MEDALLÓN DE RAPE CON BORRAJA,medallon-de-rape-con-borraja,"Pescados, mariscos y moluscos",1045,0711-medallon-de-rape-con-borraja.webp,MEDALLÓN DE RAPE CON BORRAJA receta foto
712,MOJARRA CON CHALOTAS Y PATATAS CONFITADAS,mojarra-con-chalotas-y-patatas-confitadas,"Pescados, mariscos y moluscos",1046,0712-mojarra-con-chalotas-y-patatas-confitadas.webp,MOJARRA CON CHALOTAS Y PATATAS CONFITADAS receta foto
713,SALMÓN CON MOJO DE AGUACATE,salmon-con-mojo-de-aguacate,"Pescados, mariscos y moluscos",1047,0713-salmon-con-mojo-de-aguacate.webp,SALMÓN CON MOJO DE AGUACATE receta foto
716,FANECA FRITA CON PURÉ DE PATATAS ESPECIAL,faneca-frita-con-pure-de-patatas-especial,"Pescados, mariscos y moluscos",1054,0716-faneca-frita-con-pure-de-patatas-especial.webp,FANECA FRITA CON PURÉ DE PATATAS ESPECIAL receta foto
717,FILETES DE GALLO RELLENOS DE QUESO CON VERDURAS A LA PLANCHA,filetes-de-gallo-rellenos-de-queso-con-verduras-a-la-plancha,"Pescados, mariscos y moluscos",1055,0717-filetes-de-gallo-rellenos-de-queso-con-verduras-a-la-plancha.webp,FILETES DE GALLO RELLENOS DE QUESO CON VERDURAS A LA PLANCHA receta foto
718,LIBA REBOZADA CON PIQUILLOS Y CHIPS DE YUCA,liba-rebozada-con-piquillos-y-chips-de-yuca,"Pescados, mariscos y moluscos",1056,0718-liba-rebozada-con-piquillos-y-chips-de-yuca.webp,LIBA REBOZADA CON PIQUILLOS Y CHIPS DE YUCA receta foto
721,ANCHOAS CON ESCABECHE Y PAN TOSTADO CON TOMATE,anchoas-con-escabeche-y-pan-tostado-con-tomate,"Pescados, mariscos y moluscos",1061,0721-anchoas-con-escabeche-y-pan-tostado-con-tomate.webp,ANCHOAS CON ESCABECHE Y PAN TOSTADO CON TOMATE receta foto
722,MEJILLONES AL ESTILO DE BRUSELAS CON PATATAS FRITAS,mejillones-al-estilo-de-bruselas-con-patatas-fritas,"Pescados, mariscos y moluscos",1062,0722-mejillones-al-estilo-de-bruselas-con-patatas-fritas.webp,MEJILLONES AL ESTILO DE BRUSELAS CON PATATAS FRITAS receta foto
723,SALMÓN A LA PAPILLOTE CON SALSA TÁRTARA,salmon-a-la-papillote-con-salsa-tartara,"Pescados, mariscos y moluscos",1063,0723-salmon-a-la-papillote-con-salsa-tartara.webp,SALMÓN A LA PAPILLOTE CON SALSA TÁRTARA receta foto
724,SALMÓN A LA SAL CON SALTEADO DE MELÓN Y SANDÍA,salmon-a-la-sal-con-salteado-de-melon-y-sandia,"Pescados, mariscos y moluscos",1065,0724-salmon-a-la-sal-con-salteado-de-melon-y-sandia.webp,SALMÓN A LA SAL CON SALTEADO DE MELÓN Y SANDÍA receta foto
727,PEZ DE SAN PEDRO CON SALTEADO DE ESPÁRRAGOS Y RABANITOS,pez-de-san-pedro-con-salteado-de-esparragos-y-rabanitos,"Pescados, mariscos y moluscos",1070,0727-pez-de-san-pedro-con-salteado-de-esparragos-y-rabanitos.webp,PEZ DE SAN PEDRO CON SALTEADO DE ESPÁRRAGOS Y RABANITOS receta foto
728,ALBÓNDIGAS DE LIBA CON SALSA MEUNIÈRE,albondigas-de-liba-con-salsa-meuniere,"Pescados, mariscos y moluscos",1071,0728-albondigas-de-liba-con-salsa-meuniere.webp,ALBÓNDIGAS DE LIBA CON SALSA MEUNIÈRE receta foto
729,SARDINAS CON BERENJENAS AL HORNO,sardinas-con-berenjenas-al-horno,"Pescados, mariscos y moluscos",1072,0729-sardinas-con-berenjenas-al-horno.webp,SARDINAS CON BERENJENAS AL HORNO receta foto
730,SARDINAS A MI MANERA,sardinas-a-mi-manera,"Pescados, mariscos y moluscos",1073,0730-sardinas-a-mi-manera.webp,SARDINAS A MI MANERA receta foto
733,PESCADILLAS ESPECIADAS CON ESPINACAS SALTEADAS,pescadillas-especiadas-con-espinacas-salteadas,"Pescados, mariscos y moluscos",1079,0733-pescadillas-especiadas-con-espinacas-salteadas.webp,PESCADILLAS ESPECIADAS CON ESPINACAS SALTEADAS receta foto
734,LUBINA A LA PIMIENTA VERDE CON ALGAS FRITAS,lubina-a-la-pimienta-verde-con-algas-fritas,"Pescados, mariscos y moluscos",1080,0734-lubina-a-la-pimienta-verde-con-algas-fritas.webp,LUBINA A LA PIMIENTA VERDE CON ALGAS FRITAS receta foto
735,PESCADILLA SALTEADA AL CURRY,pescadilla-salteada-al-curry,"Pescados, mariscos y moluscos",1081,0735-pescadilla-salteada-al-curry.webp,PESCADILLA SALTEADA AL CURRY receta foto
736,BACALAO AJOARRIERO,bacalao-ajoarriero,"Pescados, mariscos y moluscos",1082,0736-bacalao-ajoarriero.webp,BACALAO AJOARRIERO receta foto
738,ROLLO DE BONITO A LA ASTURIANA,rollo-de-bonito-a-la-asturiana,"Pescados, mariscos y moluscos",1084,0738-rollo-de-bonito-a-la-asturiana.webp,ROLLO DE BONITO A LA ASTURIANA receta foto
740,BACALAO CON HUEVOS,bacalao-con-huevos,"Pescados, mariscos y moluscos",1088,0740-bacalao-con-huevos.webp,BACALAO CON HUEVOS receta foto
741,CAZUELA DE BACALAO AL PILPIL,cazuela-de-bacalao-al-pilpil,"Pescados, mariscos y moluscos",1089,0741-cazuela-de-bacalao-al-pilpil.webp,CAZUELA DE BACALAO AL PILPIL receta foto
742,"SARGO CON PATATAS PANADERA, CALABAZA Y TOMATE",sargo-con-patatas-panadera-calabaza-y-tomate,"Pescados, mariscos y moluscos",1090,0742-sargo-con-patatas-panadera-calabaza-y-tomate.webp,"SARGO CON PATATAS PANADERA, CALABAZA Y TOMATE receta foto"
745,LANGOSTINOS EN SALSA CON ALCACHOFAS Y ESPÁRRAGOS REBOZADOS,langostinos-en-salsa-con-alcachofas-y-esparragos-rebozados,"Pescados, mariscos y moluscos",1095,0745-langostinos-en-salsa-con-alcachofas-y-esparragos-rebozados.webp,LANGOSTINOS EN SALSA CON ALCACHOFAS Y ESPÁRRAGOS REBOZADOS receta foto
746,TIRAS DE CALAMAR CON SETAS AL AZAFRÁN,tiras-de-calamar-con-setas-al-azafran,"Pescados, mariscos y moluscos",1096,0746-tiras-de-calamar-con-setas-al-azafran.webp,TIRAS DE CALAMAR CON SETAS AL AZAFRÁN receta foto
747,CHIPIRONES RELLENOS,chipirones-rellenos,"Pescados, mariscos y moluscos",1097,0747-chipirones-rellenos.webp,CHIPIRONES RELLENOS receta foto
748,GALLO AL JENGIBRE CON CUSCÚS,gallo-al-jengibre-con-cuscus,"Pescados, mariscos y moluscos",1099,0748-gallo-al-jengibre-con-cuscus.webp,GALLO AL JENGIBRE CON CUSCÚS receta foto
751,TOLLOS CON TOMATE,tollos-con-tomate,"Pescados, mariscos y moluscos",1104,0751-tollos-con-tomate.webp,TOLLOS CON TOMATE receta foto
752,TRUCHA CON JAMÓN A MI MANERA,trucha-con-jamon-a-mi-manera,"Pescados, mariscos y moluscos",1105,0752-trucha-con-jamon-a-mi-manera.webp,TRUCHA CON JAMÓN A MI MANERA receta foto
753,SOLDADITOS DE PAVÍA,soldaditos-de-pavia,"Pescados, mariscos y moluscos",1106,0753-soldaditos-de-pavia.webp,SOLDADITOS DE PAVÍA receta foto
755,BACALAO AL ESTILO DE VIANA DO CASTELO,bacalao-al-estilo-de-viana-do-castelo,"Pescados, mariscos y moluscos",1109,0755-bacalao-al-estilo-de-viana-do-castelo.webp,BACALAO AL ESTILO DE VIANA DO CASTELO receta foto
757,SARDINAS RELLENAS CON VERDURAS AL AZAFRÁN,sardinas-rellenas-con-verduras-al-azafran,"Pescados, mariscos y moluscos",1112,0757-sardinas-rellenas-con-verduras-al-azafran.webp,SARDINAS RELLENAS CON VERDURAS AL AZAFRÁN receta foto
758,PERLÓN CON PATATAS AL PIMENTÓN,perlon-con-patatas-al-pimenton,"Pescados, mariscos y moluscos",1113,0758-perlon-con-patatas-al-pimenton.webp,PERLÓN CON PATATAS AL PIMENTÓN receta foto
759,CARACOLES CON BACALAO DESMIGADO,caracoles-con-bacalao-desmigado,"Pescados, mariscos y moluscos",1114,0759-caracoles-con-bacalao-desmigado.webp,CARACOLES CON BACALAO DESMIGADO receta foto
760,SALMÓN AL ALIOLI CON VERDURAS,salmon-al-alioli-con-verduras,"Pescados, mariscos y moluscos",1115,0760-salmon-al-alioli-con-verduras.webp,SALMÓN AL ALIOLI CON VERDURAS receta foto
763,GALLO A LA PAPILLOTE CON CHAMPIÑONES Y CHALOTAS,gallo-a-la-papillote-con-champinones-y-chalotas,"Pescados, mariscos y moluscos",1122,0763-gallo-a-la-papillote-con-champinones-y-chalotas.webp,GALLO A LA PAPILLOTE CON CHAMPIÑONES Y CHALOTAS receta foto
764,SABIRÓN EN TEMPURA CON ENSALADA,sabiron-en-tempura-con-ensalada,"Pescados, mariscos y moluscos",1122,0764-sabiron-en-tempura-con-ensalada.webp,SABIRÓN EN TEMPURA CON ENSALADA receta foto
765,AJOARRIERO CON BOGAVANTE,ajoarriero-con-bogavante,"Pescados, mariscos y moluscos",1123,0765-ajoarriero-con-bogavante.webp,AJOARRIERO CON BOGAVANTE receta foto
767,RAYA CON SALSA DE NUECES,raya-con-salsa-de-nueces,"Pescados, mariscos y moluscos",1126,0767-raya-con-salsa-de-nueces.webp,RAYA CON SALSA DE NUECES receta foto
769,CAZUELA DE PULPO,cazuela-de-pulpo,"Pescados, mariscos y moluscos",1130,0769-cazuela-de-pulpo.webp,CAZUELA DE PULPO receta foto
770,SALMÓN ENCEBOLLADO CON TOMATE,salmon-encebollado-con-tomate,"Pescados, mariscos y moluscos",1130,0770-salmon-encebollado-con-tomate.webp,SALMÓN ENCEBOLLADO CON TOMATE receta foto
771,MERLUZA A LA KOXKERA,merluza-a-la-koxkera,"Pescados, mariscos y moluscos",1131,0771-merluza-a-la-koxkera.webp,MERLUZA A LA KOXKERA receta foto
772,CHICHARRO ASADO CON PATATAS PANADERA Y REFRITO DE TOMATE,chicharro-asado-con-patatas-panadera-y-refrito-de-tomate,"Pescados, mariscos y moluscos",1132,0772-chicharro-asado-con-patatas-panadera-y-refrito-de-tomate.webp,CHICHARRO ASADO CON PATATAS PANADERA Y REFRITO DE TOMATE receta foto
774,ANCHOAS A LA CAZUELA,anchoas-a-la-cazuela,"Pescados, mariscos y moluscos",1135,0774-anchoas-a-la-cazuela.webp,ANCHOAS A LA CAZUELA receta foto
775,"SABIRÓN, LANGOSTINO Y PANCETA",sabiron-langostino-y-panceta,"Pescados, mariscos y moluscos",1136,0775-sabiron-langostino-y-panceta.webp,"SABIRÓN, LANGOSTINO Y PANCETA receta foto"
777,ANCHOAS REBOZADAS CON PIQUILLOS CONFITADOS,anchoas-rebozadas-con-piquillos-confitados,"Pescados, mariscos y moluscos",1140,0777-anchoas-rebozadas-con-piquillos-confitados.webp,ANCHOAS REBOZADAS CON PIQUILLOS CONFITADOS receta foto
778,KOKOTXAS EN TEMPURA CON SALSA VERDE,kokotxas-en-tempura-con-salsa-verde,"Pescados, mariscos y moluscos",1140,0778-kokotxas-en-tempura-con-salsa-verde.webp,KOKOTXAS EN TEMPURA CON SALSA VERDE receta foto
780,LANGOSTINOS AL WHISKY,langostinos-al-whisky,"Pescados, mariscos y moluscos",1144,0780-langostinos-al-whisky.webp,LANGOSTINOS AL WHISKY receta foto
781,LANGOSTINOS CON GABARDINA,langostinos-con-gabardina,"Pescados, mariscos y moluscos",1144,0781-langostinos-con-gabardina.webp,LANGOSTINOS CON GABARDINA receta foto
783,"CABRACHO, PATATAS Y MEJILLONES",cabracho-patatas-y-mejillones,"Pescados, mariscos y moluscos",1147,0783-cabracho-patatas-y-mejillones.webp,"CABRACHO, PATATAS Y MEJILLONES receta foto"
784,CEVICHE DE SALMÓN CON AGUACATE,ceviche-de-salmon-con-aguacate,"Pescados, mariscos y moluscos",1148,0784-ceviche-de-salmon-con-aguacate.webp,CEVICHE DE SALMÓN CON AGUACATE receta foto
785,RAYA ADOBADA CON TOMATES RELLENOS,raya-adobada-con-tomates-rellenos,"Pescados, mariscos y moluscos",1149,0785-raya-adobada-con-tomates-rellenos.webp,RAYA ADOBADA CON TOMATES RELLENOS receta foto
788,ANCHOAS FRITAS CON ENSALADA,anchoas-fritas-con-ensalada,"Pescados, mariscos y moluscos",1156,0788-anchoas-fritas-con-ensalada.webp,ANCHOAS FRITAS CON ENSALADA receta foto
789,"CEVICHE DE LUBINA, GAMBAS, AGUACATE Y MANGO",ceviche-de-lubina-gambas-aguacate-y-mango,"Pescados, mariscos y moluscos",1157,0789-ceviche-de-lubina-gambas-aguacate-y-mango.webp,"CEVICHE DE LUBINA, GAMBAS, AGUACATE Y MANGO receta foto"
791,PESCADILLA A LA PAPILLOTE,pescadilla-a-la-papillote,"Pescados, mariscos y moluscos",1161,0791-pescadilla-a-la-papillote.webp,PESCADILLA A LA PAPILLOTE receta foto
792,PLATUSA ZARAUTZ,platusa-zarautz,"Pescados, mariscos y moluscos",1161,0792-platusa-zarautz.webp,PLATUSA ZARAUTZ receta foto
793,MOJARRA A LA PAPILLOTE,mojarra-a-la-papillote,"Pescados, mariscos y moluscos",1162,0793-mojarra-a-la-papillote.webp,MOJARRA A LA PAPILLOTE receta foto
795,SALMÓN CON CREMA DE COLIFLOR,salmon-con-crema-de-coliflor,"Pescados, mariscos y moluscos",1165,0795-salmon-con-crema-de-coliflor.webp,SALMÓN CON CREMA DE COLIFLOR receta foto
796,MERLUZA CON ESPAGUETI DE MAR,merluza-con-espagueti-de-mar,"Pescados, mariscos y moluscos",1166,0796-merluza-con-espagueti-de-mar.webp,MERLUZA CON ESPAGUETI DE MAR receta foto
799,TITAINA,titaina,"Pescados, mariscos y moluscos",1174,0799-titaina.webp,TITAINA receta foto
800,ANCHOAS AL LIMÓN,anchoas-al-limon,"Pescados, mariscos y moluscos",1174,0800-anchoas-al-limon.webp,ANCHOAS AL LIMÓN receta foto
801,CAZUELA DE PULPO CON PATATAS Y HABITAS,cazuela-de-pulpo-con-patatas-y-habitas,"Pescados, mariscos y moluscos",1175,0801-cazuela-de-pulpo-con-patatas-y-habitas.webp,CAZUELA DE PULPO CON PATATAS Y HABITAS receta foto
802,MEJILLONES ESCABECHADOS CON PATATAS PANADERA,mejillones-escabechados-con-patatas-panadera,"Pescados, mariscos y moluscos",1176,0802-mejillones-escabechados-con-patatas-panadera.webp,MEJILLONES ESCABECHADOS CON PATATAS PANADERA receta foto
805,ALBÓNDIGAS DE CABALLA EN SALSA VERDE,albondigas-de-caballa-en-salsa-verde,"Pescados, mariscos y moluscos",1181,0805-albondigas-de-caballa-en-salsa-verde.webp,ALBÓNDIGAS DE CABALLA EN SALSA VERDE receta foto
806,RAYA A LA SANLUQUEÑA,raya-a-la-sanluquena,"Pescados, mariscos y moluscos",1182,0806-raya-a-la-sanluquena.webp,RAYA A LA SANLUQUEÑA receta foto
807,ALMEJAS A LA MARINERA,almejas-a-la-marinera,"Pescados, mariscos y moluscos",1183,0807-almejas-a-la-marinera.webp,ALMEJAS A LA MARINERA receta foto
808,ANCHOAS CON TOMATE,anchoas-con-tomate,"Pescados, mariscos y moluscos",1184,0808-anchoas-con-tomate.webp,ANCHOAS CON TOMATE receta foto
811,BACALAO FRESCO CON SALSA TÁRTARA,bacalao-fresco-con-salsa-tartara,"Pescados, mariscos y moluscos",1189,0811-bacalao-fresco-con-salsa-tartara.webp,BACALAO FRESCO CON SALSA TÁRTARA receta foto
812,BACALAO FRESCO AL HORNO,bacalao-fresco-al-horno,"Pescados, mariscos y moluscos",1189,0812-bacalao-fresco-al-horno.webp,BACALAO FRESCO AL HORNO receta foto
813,BONITO ENCEBOLLADO,bonito-encebollado,"Pescados, mariscos y moluscos",1190,0813-bonito-encebollado.webp,BONITO ENCEBOLLADO receta foto
814,BESUGO AL HORNO,besugo-al-horno,"Pescados, mariscos y moluscos",1191,0814-besugo-al-horno.webp,BESUGO AL HORNO receta foto
817,BUEY DE MAR AL HORNO,buey-de-mar-al-horno,"Pescados, mariscos y moluscos",1196,0817-buey-de-mar-al-horno.webp,BUEY DE MAR AL HORNO receta foto
818,BROCHETAS DE RAPE Y LANGOSTINOS,brochetas-de-rape-y-langostinos,"Pescados, mariscos y moluscos",1197,0818-brochetas-de-rape-y-langostinos.webp,BROCHETAS DE RAPE Y LANGOSTINOS receta foto
819,CHIPIRONES AL BRANDY,chipirones-al-brandy,"Pescados, mariscos y moluscos",1198,0819-chipirones-al-brandy.webp,CHIPIRONES AL BRANDY receta foto
821,CARPACCIO DE ATÚN FRESCO,carpaccio-de-atun-fresco,"Pescados, mariscos y moluscos",1201,0821-carpaccio-de-atun-fresco.webp,CARPACCIO DE ATÚN FRESCO receta foto
823,CAZÓN REBOZADO CON ALCACHOFAS SALTEADAS,cazon-rebozado-con-alcachofas-salteadas,"Pescados, mariscos y moluscos",1205,0823-cazon-rebozado-con-alcachofas-salteadas.webp,CAZÓN REBOZADO CON ALCACHOFAS SALTEADAS receta foto
824,CARRILLERAS DE RAPE CON SALSA DE PIQUILLOS,carrilleras-de-rape-con-salsa-de-piquillos,"Pescados, mariscos y moluscos",1205,0824-carrilleras-de-rape-con-salsa-de-piquillos.webp,CARRILLERAS DE RAPE CON SALSA DE PIQUILLOS receta foto
826,MERLUZA RELLENA DE MARISCO,merluza-rellena-de-marisco,"Pescados, mariscos y moluscos",1207,0826-merluza-rellena-de-marisco.webp,MERLUZA RELLENA DE MARISCO receta foto
827,CHICHARRO A LA MOSTAZA,chicharro-a-la-mostaza,"Pescados, mariscos y moluscos",1209,0827-chicharro-a-la-mostaza.webp,CHICHARRO A LA MOSTAZA receta foto
829,CONGRIO A LA DONOSTIARRA,congrio-a-la-donostiarra,"Pescados, mariscos y moluscos",1213,0829-congrio-a-la-donostiarra.webp,CONGRIO A LA DONOSTIARRA receta foto
830,COLAS DE RAPE ASADAS CON VINAGRE,colas-de-rape-asadas-con-vinagre,"Pescados, mariscos y moluscos",1213,0830-colas-de-rape-asadas-con-vinagre.webp,COLAS DE RAPE ASADAS CON VINAGRE receta foto
831,CONGRIO AL AZAFRÁN,congrio-al-azafran,"Pescados, mariscos y moluscos",1214,0831-congrio-al-azafran.webp,CONGRIO AL AZAFRÁN receta foto
833,FANECA CON SETAS Y ALCACHOFAS,faneca-con-setas-y-alcachofas,"Pescados, mariscos y moluscos",1217,0833-faneca-con-setas-y-alcachofas.webp,FANECA CON SETAS Y ALCACHOFAS receta foto
835,FRITO MIXTO DEL MAR,frito-mixto-del-mar,"Pescados, mariscos y moluscos",1220,0835-frito-mixto-del-mar.webp,FRITO MIXTO DEL MAR receta foto
836,FILETES DE LENGUADO A LA FLORENTINA,filetes-de-lenguado-a-la-florentina,"Pescados, mariscos y moluscos",1221,0836-filetes-de-lenguado-a-la-florentina.webp,FILETES DE LENGUADO A LA FLORENTINA receta foto
837,GAMBAS AL AJILLO,gambas-al-ajillo,"Pescados, mariscos y moluscos",1222,0837-gambas-al-ajillo.webp,GAMBAS AL AJILLO receta foto
839,SABIRONES EN PAPILLOTE,sabirones-en-papillote,"Pescados, mariscos y moluscos",1223,0839-sabirones-en-papillote.webp,SABIRONES EN PAPILLOTE receta foto
841,"CAZUELA DE VERDEL, VERDURAS Y TAPIOCA",cazuela-de-verdel-verduras-y-tapioca,"Pescados, mariscos y moluscos",1229,0841-cazuela-de-verdel-verduras-y-tapioca.webp,"CAZUELA DE VERDEL, VERDURAS Y TAPIOCA receta foto"
842,BACALAO CRUJIENTE CON VERDURAS A LA PLANCHA,bacalao-crujiente-con-verduras-a-la-plancha,"Pescados, mariscos y moluscos",1230,0842-bacalao-crujiente-con-verduras-a-la-plancha.webp,BACALAO CRUJIENTE CON VERDURAS A LA PLANCHA receta foto
843,MARUCA CON CREMA DE ACELGAS,maruca-con-crema-de-acelgas,"Pescados, mariscos y moluscos",1231,0843-maruca-con-crema-de-acelgas.webp,MARUCA CON CREMA DE ACELGAS receta foto
844,LENGUADO EN SU JUGO,lenguado-en-su-jugo,"Pescados, mariscos y moluscos",1231,0844-lenguado-en-su-jugo.webp,LENGUADO EN SU JUGO receta foto
847,MERLUZA AL HORNO,merluza-al-horno,"Pescados, mariscos y moluscos",1238,0847-merluza-al-horno.webp,MERLUZA AL HORNO receta foto
848,MEJILLONES REBOZADOS,mejillones-rebozados,"Pescados, mariscos y moluscos",1238,0848-mejillones-rebozados.webp,MEJILLONES REBOZADOS receta foto
849,MERLUZA RELLENA,merluza-rellena,"Pescados, mariscos y moluscos",1239,0849-merluza-rellena.webp,MERLUZA RELLENA receta foto
851,MERO A LA MARINERA,mero-a-la-marinera,"Pescados, mariscos y moluscos",1242,0851-mero-a-la-marinera.webp,MERO A LA MARINERA receta foto
853,MOJARRA EN HOJALDRE,mojarra-en-hojaldre,"Pescados, mariscos y moluscos",1246,0853-mojarra-en-hojaldre.webp,MOJARRA EN HOJALDRE receta foto
854,MERO AL PAPILLOTE,mero-al-papillote,"Pescados, mariscos y moluscos",1246,0854-mero-al-papillote.webp,MERO AL PAPILLOTE receta foto
855,PALOMETA A LA SIDRA,palometa-a-la-sidra,"Pescados, mariscos y moluscos",1247,0855-palometa-a-la-sidra.webp,PALOMETA A LA SIDRA receta foto
856,PASTEL DE PESCADO Y ALGAS,pastel-de-pescado-y-algas,"Pescados, mariscos y moluscos",1248,0856-pastel-de-pescado-y-algas.webp,PASTEL DE PESCADO Y ALGAS receta foto
