id,title,slug,category,source_page,expected_filename,search_query_suggestion
1,TOSTAS DE CALABACÍN Y PAVO AL PESTO,tostas-de-calabacin-y-pavo-al-pesto,Entrantes,10,0001-tostas-de-calabacin-y-pavo-al-pesto.webp,TOSTAS DE CALABACÍN Y PAVO AL PESTO receta foto
2,TOSTAS DE QUESO FRESCO Y TAPENADE,tostas-de-queso-fresco-y-tapenade,Entrantes,11,0002-tostas-de-queso-fresco-y-tapenade.webp,TOSTAS DE QUESO FRESCO Y TAPENADE receta foto
4,BLOODY MARY CON BERBERECHOS,bloody-mary-con-berberechos,Entrantes,14,0004-bloody-mary-con-berberechos.webp,BLOODY MARY CON BERBERECHOS receta foto
5,"HUMMUS CON ZANAHORIA, PEPINO Y APIO",hummus-con-zanahoria-pepino-y-apio,Entrantes,15,0005-hummus-con-zanahoria-pepino-y-apio.webp,"HUMMUS CON ZANAHORIA, PEPINO Y APIO receta foto"
7,BAGUETTES RELLENAS DE ENSALADILLA,baguettes-rellenas-de-ensaladilla,Entrantes,17,0007-baguettes-rellenas-de-ensaladilla.webp,BAGUETTES RELLENAS DE ENSALADILLA receta foto
8,BROCHETAS DE ANCHOAS Y GUINDILLAS,brochetas-de-anchoas-y-guindillas,Entrantes,19,0008-brochetas-de-anchoas-y-guindillas.webp,BROCHETAS DE ANCHOAS Y GUINDILLAS receta foto
10,SAQUITOS DE VERDURAS CON SALSA DE LECHE,saquitos-de-verduras-con-salsa-de-leche,Entrantes,23,0010-saquitos-de-verduras-con-salsa-de-leche.webp,SAQUITOS DE VERDURAS CON SALSA DE LECHE receta foto
11,PUERROS CON SALSA ROMESCO,puerros-con-salsa-romesco,Entrantes,23,0011-puerros-con-salsa-romesco.webp,PUERROS CON SALSA ROMESCO receta foto
13,PUERROS EN VINAGRETA,puerros-en-vinagreta,Entrantes,26,0013-puerros-en-vinagreta.webp,PUERROS EN VINAGRETA receta foto
14,SETAS GRATINADAS,setas-gratinadas,Entrantes,27,0014-setas-gratinadas.webp,SETAS GRATINADAS receta foto
16,ALBÓNDIGAS DE PATATA,albondigas-de-patata,Entrantes,29,0016-albondigas-de-patata.webp,ALBÓNDIGAS DE PATATA receta foto
17,CHAMPIÑONES A LA PLANCHA CON GAMBAS,champinones-a-la-plancha-con-gambas,Entrantes,30,0017-champinones-a-la-plancha-con-gambas.webp,CHAMPIÑONES A LA PLANCHA CON GAMBAS receta foto
19,AGUACATES RELLENOS DE SALMÓN,aguacates-rellenos-de-salmon,Entrantes,33,0019-aguacates-rellenos-de-salmon.webp,AGUACATES RELLENOS DE SALMÓN receta foto
20,APIO CON QUESO,apio-con-queso,Entrantes,34,0020-apio-con-queso.webp,APIO CON QUESO receta foto
22,MEJILLONES EN SALSA DE TOMATE PICANTE,mejillones-en-salsa-de-tomate-picante,Entrantes,37,0022-mejillones-en-salsa-de-tomate-picante.webp,MEJILLONES EN SALSA DE TOMATE PICANTE receta foto
23,FRITOS VARIADOS,fritos-variados,Entrantes,38,0023-fritos-variados.webp,FRITOS VARIADOS receta foto
25,CESTAS DE PRIMAVERA,cestas-de-primavera,Entrantes,41,0025-cestas-de-primavera.webp,CESTAS DE PRIMAVERA receta foto
26,CROQUETAS DE JAMÓN Y POLLO,croquetas-de-jamon-y-pollo,Entrantes,42,0026-croquetas-de-jamon-y-pollo.webp,CROQUETAS DE JAMÓN Y POLLO receta foto
28,CHAMPIÑONES EN SALSA DE VINO,champinones-en-salsa-de-vino,Entrantes,45,0028-champinones-en-salsa-de-vino.webp,CHAMPIÑONES EN SALSA DE VINO receta foto
29,PIMIENTO ADOBADO CON CHAMPIÑONES,pimiento-adobado-con-champinones,Entrantes,46,0029-pimiento-adobado-con-champinones.webp,PIMIENTO ADOBADO CON CHAMPIÑONES receta foto
31,ENSALADILLA DE PATATA CON SALMÓN Y AGUACATE,ensaladilla-de-patata-con-salmon-y-aguacate,Ensaladas,51,0031-ensaladilla-de-patata-con-salmon-y-aguacate.webp,ENSALADILLA DE PATATA CON SALMÓN Y AGUACATE receta foto
32,ENSALADA DE CHAMPIÑONES Y CALABACÍN,ensalada-de-champinones-y-calabacin,Ensaladas,52,0032-ensalada-de-champinones-y-calabacin.webp,ENSALADA DE CHAMPIÑONES Y CALABACÍN receta foto
34,ENSALADA TEMPLADA DE LENTEJAS Y LANGOSTINOS,ensalada-templada-de-lentejas-y-langostinos,Ensaladas,55,0034-ensalada-templada-de-lentejas-y-langostinos.webp,ENSALADA TEMPLADA DE LENTEJAS Y LANGOSTINOS receta foto
35,ENSALADA OTOÑAL,ensalada-otonal,Ensaladas,56,0035-ensalada-otonal.webp,ENSALADA OTOÑAL receta foto
38,ENSALADA DE ENDIBIAS Y SALMÓN AHUMADO,ensalada-de-endibias-y-salmon-ahumado,Ensaladas,61,0038-ensalada-de-endibias-y-salmon-ahumado.webp,ENSALADA DE ENDIBIAS Y SALMÓN AHUMADO receta foto
39,"ENSALADA DE TOMATE, PIMIENTOS Y SALMÓN",ensalada-de-tomate-pimientos-y-salmon,Ensaladas,62,0039-ensalada-de-tomate-pimientos-y-salmon.webp,"ENSALADA DE TOMATE, PIMIENTOS Y SALMÓN receta foto"
40,ENSALADA DE REMOLACHA Y QUESO CON PESTO DE PISTACHOS,ensalada-de-remolacha-y-queso-con-pesto-de-pistachos,Ensaladas,63,0040-ensalada-de-remolacha-y-queso-con-pesto-de-pistachos.webp,ENSALADA DE REMOLACHA Y QUESO CON PESTO DE PISTACHOS receta foto
41,ENSALADA DE GARBANZOS Y FOIE,ensalada-de-garbanzos-y-foie,Ensaladas,65,0041-ensalada-de-garbanzos-y-foie.webp,ENSALADA DE GARBANZOS Y FOIE receta foto
43,COGOLLOS RELLENOS SOBRE TOMATE CONFITADO,cogollos-rellenos-sobre-tomate-confitado,Ensaladas,68,0043-cogollos-rellenos-sobre-tomate-confitado.webp,COGOLLOS RELLENOS SOBRE TOMATE CONFITADO receta foto
44,"ENSALADA DE LECHUGA, GARBANZOS COCIDOS Y REMOLACHA",ensalada-de-lechuga-garbanzos-cocidos-y-remolacha,Ensaladas,69,0044-ensalada-de-lechuga-garbanzos-cocidos-y-remolacha.webp,"ENSALADA DE LECHUGA, GARBANZOS COCIDOS Y REMOLACHA receta foto"
47,ENSALADA DE INVIERNO CON FRUTOS DE MAR,ensalada-de-invierno-con-frutos-de-mar,Ensaladas,74,0047-ensalada-de-invierno-con-frutos-de-mar.webp,ENSALADA DE INVIERNO CON FRUTOS DE MAR receta foto
48,ENSALADA DE CHAMPIÑONES Y REMOLACHA,ensalada-de-champinones-y-remolacha,Ensaladas,76,0048-ensalada-de-champinones-y-remolacha.webp,ENSALADA DE CHAMPIÑONES Y REMOLACHA receta foto
49,ENSALADA DE BACALAO AL PILPIL,ensalada-de-bacalao-al-pilpil,Ensaladas,76,0049-ensalada-de-bacalao-al-pilpil.webp,ENSALADA DE BACALAO AL PILPIL receta foto
50,ENSALADA DE POCHAS Y BACALAO,ensalada-de-pochas-y-bacalao,Ensaladas,77,0050-ensalada-de-pochas-y-bacalao.webp,ENSALADA DE POCHAS Y BACALAO receta foto
52,"ENSALADILLA DE LANGOSTINOS, CALABACÍN Y PATATA",ensaladilla-de-langostinos-calabacin-y-patata,Ensaladas,80,0052-ensaladilla-de-langostinos-calabacin-y-patata.webp,"ENSALADILLA DE LANGOSTINOS, CALABACÍN Y PATATA receta foto"
53,"COGOLLOS RELLENOS DE JAMÓN, REMOLACHA Y QUESO",cogollos-rellenos-de-jamon-remolacha-y-queso,Ensaladas,81,0053-cogollos-rellenos-de-jamon-remolacha-y-queso.webp,"COGOLLOS RELLENOS DE JAMÓN, REMOLACHA Y QUESO receta foto"
55,ENSALADA DE LENTEJAS NEGRAS,ensalada-de-lentejas-negras,Ensaladas,84,0055-ensalada-de-lentejas-negras.webp,ENSALADA DE LENTEJAS NEGRAS receta foto
56,ENSALADA DE MOLLEJAS DE PATO,ensalada-de-mollejas-de-pato,Ensaladas,85,0056-ensalada-de-mollejas-de-pato.webp,ENSALADA DE MOLLEJAS DE PATO receta foto
59,ENSALADA DE TOMATE Y JUDÍAS VERDES,ensalada-de-tomate-y-judias-verdes,Ensaladas,91,0059-ensalada-de-tomate-y-judias-verdes.webp,ENSALADA DE TOMATE Y JUDÍAS VERDES receta foto
60,"ENSALADA DE SALMÓN, HABAS Y RABANITOS",ensalada-de-salmon-habas-y-rabanitos,Ensaladas,92,0060-ensalada-de-salmon-habas-y-rabanitos.webp,"ENSALADA DE SALMÓN, HABAS Y RABANITOS receta foto"
61,ENSALADA DE MANZANA Y TOMATE,ensalada-de-manzana-y-tomate,Ensaladas,93,0061-ensalada-de-manzana-y-tomate.webp,ENSALADA DE MANZANA Y TOMATE receta foto
62,ENSALADA DE REMOLACHA,ensalada-de-remolacha,Ensaladas,94,0062-ensalada-de-remolacha.webp,ENSALADA DE REMOLACHA receta foto
64,ENSALADA DE GARBANZOS Y JUDÍAS VERDES,ensalada-de-garbanzos-y-judias-verdes,Ensaladas,97,0064-ensalada-de-garbanzos-y-judias-verdes.webp,ENSALADA DE GARBANZOS Y JUDÍAS VERDES receta foto
66,ENSALADA DE PATATA Y CEBOLLETA,ensalada-de-patata-y-cebolleta,Ensaladas,101,0066-ensalada-de-patata-y-cebolleta.webp,ENSALADA DE PATATA Y CEBOLLETA receta foto
67,ENSALADA DE COGOLLOS,ensalada-de-cogollos,Ensaladas,102,0067-ensalada-de-cogollos.webp,ENSALADA DE COGOLLOS receta foto
68,"ENSALADA DE BERROS, PEPINO Y ZANAHORIA",ensalada-de-berros-pepino-y-zanahoria,Ensaladas,102,0068-ensalada-de-berros-pepino-y-zanahoria.webp,"ENSALADA DE BERROS, PEPINO Y ZANAHORIA receta foto"
70,ENSALADA DE GARBANZOS,ensalada-de-garbanzos,Ensaladas,105,0070-ensalada-de-garbanzos.webp,ENSALADA DE GARBANZOS receta foto
71,"ENSALADA DE RÚCULA, QUESO Y PERA",ensalada-de-rucula-queso-y-pera,Ensaladas,106,0071-ensalada-de-rucula-queso-y-pera.webp,"ENSALADA DE RÚCULA, QUESO Y PERA receta foto"
73,ENSALADA DE AGUACATE Y REMOLACHA,ensalada-de-aguacate-y-remolacha,Ensaladas,108,0073-ensalada-de-aguacate-y-remolacha.webp,ENSALADA DE AGUACATE Y REMOLACHA receta foto
74,ENSALADA DE CANÓNIGOS Y RABANITOS,ensalada-de-canonigos-y-rabanitos,Ensaladas,109,0074-ensalada-de-canonigos-y-rabanitos.webp,ENSALADA DE CANÓNIGOS Y RABANITOS receta foto
76,ENSALADA DE SANDÍA,ensalada-de-sandia,Ensaladas,112,0076-ensalada-de-sandia.webp,ENSALADA DE SANDÍA receta foto
77,ENSALADA DE ESCAROLA Y PALMITO,ensalada-de-escarola-y-palmito,Ensaladas,113,0077-ensalada-de-escarola-y-palmito.webp,ENSALADA DE ESCAROLA Y PALMITO receta foto
79,ENSALADA DE MEJILLONES Y GERMINADOS,ensalada-de-mejillones-y-germinados,Ensaladas,116,0079-ensalada-de-mejillones-y-germinados.webp,ENSALADA DE MEJILLONES Y GERMINADOS receta foto
80,ENSALADA DE PERA Y RABANITOS,ensalada-de-pera-y-rabanitos,Ensaladas,117,0080-ensalada-de-pera-y-rabanitos.webp,ENSALADA DE PERA Y RABANITOS receta foto
82,ENSALADA DE ARROZ CON PAVO Y SETAS,ensalada-de-arroz-con-pavo-y-setas,Ensaladas,120,0082-ensalada-de-arroz-con-pavo-y-setas.webp,ENSALADA DE ARROZ CON PAVO Y SETAS receta foto
84,ENSALADA DE ENDIBIAS CON VINAGRETA DE ARÁNDANOS,ensalada-de-endibias-con-vinagreta-de-arandanos,Ensaladas,124,0084-ensalada-de-endibias-con-vinagreta-de-arandanos.webp,ENSALADA DE ENDIBIAS CON VINAGRETA DE ARÁNDANOS receta foto
85,ENSALADA DE MANCHONES Y JUDÍAS VERDES,ensalada-de-manchones-y-judias-verdes,Ensaladas,125,0085-ensalada-de-manchones-y-judias-verdes.webp,ENSALADA DE MANCHONES Y JUDÍAS VERDES receta foto
86,ENSALADA DE BEICON Y QUESO DE CABRA,ensalada-de-beicon-y-queso-de-cabra,Ensaladas,126,0086-ensalada-de-beicon-y-queso-de-cabra.webp,ENSALADA DE BEICON Y QUESO DE CABRA receta foto
89,ENSALADA DE ARROZ CON PAVO Y CACAHUETES,ensalada-de-arroz-con-pavo-y-cacahuetes,Ensaladas,132,0089-ensalada-de-arroz-con-pavo-y-cacahuetes.webp,ENSALADA DE ARROZ CON PAVO Y CACAHUETES receta foto
90,ENSALADA DE CHAMPIÑONES Y NARANJA,ensalada-de-champinones-y-naranja,Ensaladas,133,0090-ensalada-de-champinones-y-naranja.webp,ENSALADA DE CHAMPIÑONES Y NARANJA receta foto
91,COLES DE BRUSELAS EN SALSA VIZCAÍNA,coles-de-bruselas-en-salsa-vizcaina,"Verduras, hortalizas y setas",135,0091-coles-de-bruselas-en-salsa-vizcaina.webp,COLES DE BRUSELAS EN SALSA VIZCAÍNA receta foto
92,GRATINADO DE CEBOLLETAS Y ESPÁRRAGOS CON VELOUTÉ,gratinado-de-cebolletas-y-esparragos-con-veloute,"Verduras, hortalizas y setas",136,0092-gratinado-de-cebolletas-y-esparragos-con-veloute.webp,GRATINADO DE CEBOLLETAS Y ESPÁRRAGOS CON VELOUTÉ receta foto
94,COLES DE BRUSELAS GRATINADAS CON QUESO,coles-de-bruselas-gratinadas-con-queso,"Verduras, hortalizas y setas",140,0094-coles-de-bruselas-gratinadas-con-queso.webp,COLES DE BRUSELAS GRATINADAS CON QUESO receta foto
95,ALCACHOFAS CON PATATAS Y BERBERECHOS,alcachofas-con-patatas-y-berberechos,"Verduras, hortalizas y setas",141,0095-alcachofas-con-patatas-y-berberechos.webp,ALCACHOFAS CON PATATAS Y BERBERECHOS receta foto
98,ENDIBIAS GUISADAS CON JAMÓN COCIDO,endibias-guisadas-con-jamon-cocido,"Verduras, hortalizas y setas",145,0098-endibias-guisadas-con-jamon-cocido.webp,ENDIBIAS GUISADAS CON JAMÓN COCIDO receta foto
99,ALCACHOFAS REBOZADAS CON CREMA DE MAÍZ,alcachofas-rebozadas-con-crema-de-maiz,"Verduras, hortalizas y setas",146,0099-alcachofas-rebozadas-con-crema-de-maiz.webp,ALCACHOFAS REBOZADAS CON CREMA DE MAÍZ receta foto
100,CEBOLLAS RELLENAS DE ESPINACAS AL QUESO,cebollas-rellenas-de-espinacas-al-queso,"Verduras, hortalizas y setas",148,0100-cebollas-rellenas-de-espinacas-al-queso.webp,CEBOLLAS RELLENAS DE ESPINACAS AL QUESO receta foto
102,QUINOA CON VERDURAS,quinoa-con-verduras,"Verduras, hortalizas y setas",149,0102-quinoa-con-verduras.webp,QUINOA CON VERDURAS receta foto
103,FONDUE DE VERDURAS Y DÁTILES,fondue-de-verduras-y-datiles,"Verduras, hortalizas y setas",151,0103-fondue-de-verduras-y-datiles.webp,FONDUE DE VERDURAS Y DÁTILES receta foto
104,ACELGAS RELLENAS DE ARROZ Y CEBOLLA,acelgas-rellenas-de-arroz-y-cebolla,"Verduras, hortalizas y setas",153,0104-acelgas-rellenas-de-arroz-y-cebolla.webp,ACELGAS RELLENAS DE ARROZ Y CEBOLLA receta foto
106,PUERROS COCIDOS,puerros-cocidos,"Verduras, hortalizas y setas",156,0106-puerros-cocidos.webp,PUERROS COCIDOS receta foto
107,ACELGAS CON ALMEJAS EN SALSA VERDE,acelgas-con-almejas-en-salsa-verde,"Verduras, hortalizas y setas",157,0107-acelgas-con-almejas-en-salsa-verde.webp,ACELGAS CON ALMEJAS EN SALSA VERDE receta foto
110,COLIFLOR AL HORNO CON SALSA DE NARANJA Y CAVA,coliflor-al-horno-con-salsa-de-naranja-y-cava,"Verduras, hortalizas y setas",164,0110-coliflor-al-horno-con-salsa-de-naranja-y-cava.webp,COLIFLOR AL HORNO CON SALSA DE NARANJA Y CAVA receta foto
111,CHAMPIÑONES EN TEMPURA DE COLORES,champinones-en-tempura-de-colores,"Verduras, hortalizas y setas",165,0111-champinones-en-tempura-de-colores.webp,CHAMPIÑONES EN TEMPURA DE COLORES receta foto
112,VERDURAS DE TEMPORADA CON SALSA HOLANDESA,verduras-de-temporada-con-salsa-holandesa,"Verduras, hortalizas y setas",166,0112-verduras-de-temporada-con-salsa-holandesa.webp,VERDURAS DE TEMPORADA CON SALSA HOLANDESA receta foto
113,PENTAGRAMA PRIMAVERAL,pentagrama-primaveral,"Verduras, hortalizas y setas",167,0113-pentagrama-primaveral.webp,PENTAGRAMA PRIMAVERAL receta foto
115,BORRAJAS GRATINADAS,borrajas-gratinadas,"Verduras, hortalizas y setas",170,0115-borrajas-gratinadas.webp,BORRAJAS GRATINADAS receta foto
116,BROCHETAS DE COLES DE BRUSELAS CON SALSA CURRY,brochetas-de-coles-de-bruselas-con-salsa-curry,"Verduras, hortalizas y setas",171,0116-brochetas-de-coles-de-bruselas-con-salsa-curry.webp,BROCHETAS DE COLES DE BRUSELAS CON SALSA CURRY receta foto
118,HOJAS DE COL RELLENAS DE JAMÓN Y QUESO,hojas-de-col-rellenas-de-jamon-y-queso,"Verduras, hortalizas y setas",174,0118-hojas-de-col-rellenas-de-jamon-y-queso.webp,HOJAS DE COL RELLENAS DE JAMÓN Y QUESO receta foto
119,TIMBAL DE VERDURAS Y BACALAO,timbal-de-verduras-y-bacalao,"Verduras, hortalizas y setas",175,0119-timbal-de-verduras-y-bacalao.webp,TIMBAL DE VERDURAS Y BACALAO receta foto
122,ROMANESCO CON PATATAS Y ALIOLI,romanesco-con-patatas-y-alioli,"Verduras, hortalizas y setas",181,0122-romanesco-con-patatas-y-alioli.webp,ROMANESCO CON PATATAS Y ALIOLI receta foto
123,JUDÍAS VERDES CON PAN FRITO Y MAYONESA DE AZAFRÁN,judias-verdes-con-pan-frito-y-mayonesa-de-azafran,"Verduras, hortalizas y setas",182,0123-judias-verdes-con-pan-frito-y-mayonesa-de-azafran.webp,JUDÍAS VERDES CON PAN FRITO Y MAYONESA DE AZAFRÁN receta foto
124,ROMANESCO CON MORCILLA Y SALSA DE ALUBIAS,romanesco-con-morcilla-y-salsa-de-alubias,"Verduras, hortalizas y setas",183,0124-romanesco-con-morcilla-y-salsa-de-alubias.webp,ROMANESCO CON MORCILLA Y SALSA DE ALUBIAS receta foto
125,PENCAS RELLENAS CON SALSA DE TOMATES SECOS,pencas-rellenas-con-salsa-de-tomates-secos,"Verduras, hortalizas y setas",184,0125-pencas-rellenas-con-salsa-de-tomates-secos.webp,PENCAS RELLENAS CON SALSA DE TOMATES SECOS receta foto
128,ACHICORIA CON BECHAMEL,achicoria-con-bechamel,"Verduras, hortalizas y setas",189,0128-achicoria-con-bechamel.webp,ACHICORIA CON BECHAMEL receta foto
129,COLES DE BRUSELAS CON PURÉ DE PATATA Y QUESO,coles-de-bruselas-con-pure-de-patata-y-queso,"Verduras, hortalizas y setas",190,0129-coles-de-bruselas-con-pure-de-patata-y-queso.webp,COLES DE BRUSELAS CON PURÉ DE PATATA Y QUESO receta foto
130,BERENJENAS RELLENAS DE CUSCÚS Y PAVO,berenjenas-rellenas-de-cuscus-y-pavo,"Verduras, hortalizas y setas",191,0130-berenjenas-rellenas-de-cuscus-y-pavo.webp,BERENJENAS RELLENAS DE CUSCÚS Y PAVO receta foto
131,JUDÍAS VERDES A LA GALLEGA,judias-verdes-a-la-gallega,"Verduras, hortalizas y setas",192,0131-judias-verdes-a-la-gallega.webp,JUDÍAS VERDES A LA GALLEGA receta foto
134,RATATOUILLE,ratatouille,"Verduras, hortalizas y setas",197,0134-ratatouille.webp,RATATOUILLE receta foto
135,BRÓCOLI Y MEJILLONES EN SALSA VERDE,brocoli-y-mejillones-en-salsa-verde,"Verduras, hortalizas y setas",198,0135-brocoli-y-mejillones-en-salsa-verde.webp,BRÓCOLI Y MEJILLONES EN SALSA VERDE receta foto
136,ACHICORIA CON CALABACÍN Y MANZANA,achicoria-con-calabacin-y-manzana,"Verduras, hortalizas y setas",199,0136-achicoria-con-calabacin-y-manzana.webp,ACHICORIA CON CALABACÍN Y MANZANA receta foto
137,REPOLLO CON ZANAHORIA Y MORCILLA,repollo-con-zanahoria-y-morcilla,"Verduras, hortalizas y setas",200,0137-repollo-con-zanahoria-y-morcilla.webp,REPOLLO CON ZANAHORIA Y MORCILLA receta foto
139,COLIFLOR CON BECHAMEL Y JAMÓN,coliflor-con-bechamel-y-jamon,"Verduras, hortalizas y setas",203,0139-coliflor-con-bechamel-y-jamon.webp,COLIFLOR CON BECHAMEL Y JAMÓN receta foto
140,PIMIENTOS RELLENOS DE MORCILLA,pimientos-rellenos-de-morcilla,"Verduras, hortalizas y setas",204,0140-pimientos-rellenos-de-morcilla.webp,PIMIENTOS RELLENOS DE MORCILLA receta foto
143,PIMIENTOS RELLENOS DE TORTILLA DE PATATAS CON MORCILLA,pimientos-rellenos-de-tortilla-de-patatas-con-morcilla,"Verduras, hortalizas y setas",210,0143-pimientos-rellenos-de-tortilla-de-patatas-con-morcilla.webp,PIMIENTOS RELLENOS DE TORTILLA DE PATATAS CON MORCILLA receta foto
144,GRATINADO DE CALABACÍN AL ROMERO,gratinado-de-calabacin-al-romero,"Verduras, hortalizas y setas",211,0144-gratinado-de-calabacin-al-romero.webp,GRATINADO DE CALABACÍN AL ROMERO receta foto
145,"ALBÓNDIGAS DE ESPINACAS, QUESO Y PIÑONES",albondigas-de-espinacas-queso-y-pinones,"Verduras, hortalizas y setas",212,0145-albondigas-de-espinacas-queso-y-pinones.webp,"ALBÓNDIGAS DE ESPINACAS, QUESO Y PIÑONES receta foto"
146,"JUDÍAS VERDES CON PATATAS, JAMÓN Y HUEVO",judias-verdes-con-patatas-jamon-y-huevo,"Verduras, hortalizas y setas",213,0146-judias-verdes-con-patatas-jamon-y-huevo.webp,"JUDÍAS VERDES CON PATATAS, JAMÓN Y HUEVO receta foto"
149,COLIFLOR Y BRÓCOLI EN ESCABECHE,coliflor-y-brocoli-en-escabeche,"Verduras, hortalizas y setas",219,0149-coliflor-y-brocoli-en-escabeche.webp,COLIFLOR Y BRÓCOLI EN ESCABECHE receta foto
150,PENCAS RELLENAS DE PAVO Y SETAS,pencas-rellenas-de-pavo-y-setas,"Verduras, hortalizas y setas",221,0150-pencas-rellenas-de-pavo-y-setas.webp,PENCAS RELLENAS DE PAVO Y SETAS receta foto
151,ALCACHOFAS CON HUEVO Y TRUFA,alcachofas-con-huevo-y-trufa,"Verduras, hortalizas y setas",221,0151-alcachofas-con-huevo-y-trufa.webp,ALCACHOFAS CON HUEVO Y TRUFA receta foto
152,JUDÍAS VERDES CON ALMEJAS,judias-verdes-con-almejas,"Verduras, hortalizas y setas",222,0152-judias-verdes-con-almejas.webp,JUDÍAS VERDES CON ALMEJAS receta foto
154,VERDURAS A LA PAPILLOTE CON SALSA HOLANDESA,verduras-a-la-papillote-con-salsa-holandesa,"Verduras, hortalizas y setas",225,0154-verduras-a-la-papillote-con-salsa-holandesa.webp,VERDURAS A LA PAPILLOTE CON SALSA HOLANDESA receta foto
155,BIMI CON PURÉ DE PATATAS,bimi-con-pure-de-patatas,"Verduras, hortalizas y setas",226,0155-bimi-con-pure-de-patatas.webp,BIMI CON PURÉ DE PATATAS receta foto
157,MENESTRA DE INVIERNO,menestra-de-invierno,"Verduras, hortalizas y setas",229,0157-menestra-de-invierno.webp,MENESTRA DE INVIERNO receta foto
159,BORRAJA CON ARROZ Y SETAS,borraja-con-arroz-y-setas,"Verduras, hortalizas y setas",233,0159-borraja-con-arroz-y-setas.webp,BORRAJA CON ARROZ Y SETAS receta foto
160,BRÓCOLI CON CALABAZA Y PATATA,brocoli-con-calabaza-y-patata,"Verduras, hortalizas y setas",234,0160-brocoli-con-calabaza-y-patata.webp,BRÓCOLI CON CALABAZA Y PATATA receta foto
161,HAMBURGUESAS DE VERDURAS CON SALSA DE TOMATE,hamburguesas-de-verduras-con-salsa-de-tomate,"Verduras, hortalizas y setas",235,0161-hamburguesas-de-verduras-con-salsa-de-tomate.webp,HAMBURGUESAS DE VERDURAS CON SALSA DE TOMATE receta foto
163,ROMANESCO CON BECHAMEL Y TEJAS DE JAMÓN,romanesco-con-bechamel-y-tejas-de-jamon,"Verduras, hortalizas y setas",238,0163-romanesco-con-bechamel-y-tejas-de-jamon.webp,ROMANESCO CON BECHAMEL Y TEJAS DE JAMÓN receta foto
164,BORRAJA CON BERBERECHOS Y JAMÓN,borraja-con-berberechos-y-jamon,"Verduras, hortalizas y setas",239,0164-borraja-con-berberechos-y-jamon.webp,BORRAJA CON BERBERECHOS Y JAMÓN receta foto
167,VERDURAS AL CURRY CON ARROZ BASMATI,verduras-al-curry-con-arroz-basmati,"Verduras, hortalizas y setas",244,0167-verduras-al-curry-con-arroz-basmati.webp,VERDURAS AL CURRY CON ARROZ BASMATI receta foto
168,BISALTOS CON PATATAS,bisaltos-con-patatas,"Verduras, hortalizas y setas",246,0168-bisaltos-con-patatas.webp,BISALTOS CON PATATAS receta foto
169,CREMA DE BRÓCOLI CON GAMBAS GABARDINA,crema-de-brocoli-con-gambas-gabardina,"Verduras, hortalizas y setas",246,0169-crema-de-brocoli-con-gambas-gabardina.webp,CREMA DE BRÓCOLI CON GAMBAS GABARDINA receta foto
170,CARDO CON FOIE Y ALMENDRAS,cardo-con-foie-y-almendras,"Verduras, hortalizas y setas",247,0170-cardo-con-foie-y-almendras.webp,CARDO CON FOIE Y ALMENDRAS receta foto
172,TEMPURA DE HORTALIZAS Y LANGOSTINOS,tempura-de-hortalizas-y-langostinos,"Verduras, hortalizas y setas",250,0172-tempura-de-hortalizas-y-langostinos.webp,TEMPURA DE HORTALIZAS Y LANGOSTINOS receta foto
173,BUÑUELOS DE COLIFLOR CON SALSA DE LECHUGA,bunuelos-de-coliflor-con-salsa-de-lechuga,"Verduras, hortalizas y setas",251,0173-bunuelos-de-coliflor-con-salsa-de-lechuga.webp,BUÑUELOS DE COLIFLOR CON SALSA DE LECHUGA receta foto
174,PENCAS RELLENAS CON SALSA DE CHORICEROS,pencas-rellenas-con-salsa-de-choriceros,"Verduras, hortalizas y setas",252,0174-pencas-rellenas-con-salsa-de-choriceros.webp,PENCAS RELLENAS CON SALSA DE CHORICEROS receta foto
177,"TIMBAL DE PATATA, LANGOSTINOS, AGUACATE Y TOMATE",timbal-de-patata-langostinos-aguacate-y-tomate,"Verduras, hortalizas y setas",260,0177-timbal-de-patata-langostinos-aguacate-y-tomate.webp,"TIMBAL DE PATATA, LANGOSTINOS, AGUACATE Y TOMATE receta foto"
178,PATATAS BRAVAS CON SALCHICHAS,patatas-bravas-con-salchichas,"Verduras, hortalizas y setas",260,0178-patatas-bravas-con-salchichas.webp,PATATAS BRAVAS CON SALCHICHAS receta foto
179,PATATAS CON ENSALADILLA DE CABEZA DE JABALÍ,patatas-con-ensaladilla-de-cabeza-de-jabali,"Verduras, hortalizas y setas",262,0179-patatas-con-ensaladilla-de-cabeza-de-jabali.webp,PATATAS CON ENSALADILLA DE CABEZA DE JABALÍ receta foto
181,PATATAS EN SALSA VERDE CON HUEVOS AL PLATO,patatas-en-salsa-verde-con-huevos-al-plato,"Verduras, hortalizas y setas",264,0181-patatas-en-salsa-verde-con-huevos-al-plato.webp,PATATAS EN SALSA VERDE CON HUEVOS AL PLATO receta foto
182,PATATAS A LA ALCORINA,patatas-a-la-alcorina,"Verduras, hortalizas y setas",265,0182-patatas-a-la-alcorina.webp,PATATAS A LA ALCORINA receta foto
185,PATATAS EN CALDILLO,patatas-en-caldillo,"Verduras, hortalizas y setas",270,0185-patatas-en-caldillo.webp,PATATAS EN CALDILLO receta foto
186,"TIMBALES DE PATATA, PIMIENTO Y BACALAO",timbales-de-patata-pimiento-y-bacalao,"Verduras, hortalizas y setas",271,0186-timbales-de-patata-pimiento-y-bacalao.webp,"TIMBALES DE PATATA, PIMIENTO Y BACALAO receta foto"
187,PATATAS CON BERBERECHOS PICANTES,patatas-con-berberechos-picantes,"Verduras, hortalizas y setas",272,0187-patatas-con-berberechos-picantes.webp,PATATAS CON BERBERECHOS PICANTES receta foto
188,PATATAS CON SARDINAS,patatas-con-sardinas,"Verduras, hortalizas y setas",273,0188-patatas-con-sardinas.webp,PATATAS CON SARDINAS receta foto
190,TORTITAS DE PATATA Y QUESO,tortitas-de-patata-y-queso,"Verduras, hortalizas y setas",276,0190-tortitas-de-patata-y-queso.webp,TORTITAS DE PATATA Y QUESO receta foto
191,PATATAS CON CHORIZO,patatas-con-chorizo,"Verduras, hortalizas y setas",277,0191-patatas-con-chorizo.webp,PATATAS CON CHORIZO receta foto
193,ALBÓNDIGAS DE VERDURAS,albondigas-de-verduras,"Verduras, hortalizas y setas",280,0193-albondigas-de-verduras.webp,ALBÓNDIGAS DE VERDURAS receta foto
195,LASAÑA DE JAMÓN Y PATATA CON QUESO,lasana-de-jamon-y-patata-con-queso,"Verduras, hortalizas y setas",284,0195-lasana-de-jamon-y-patata-con-queso.webp,LASAÑA DE JAMÓN Y PATATA CON QUESO receta foto
196,"PASTELES DE SETAS, JAMÓN Y QUESO",pasteles-de-setas-jamon-y-queso,"Verduras, hortalizas y setas",285,0196-pasteles-de-setas-jamon-y-queso.webp,"PASTELES DE SETAS, JAMÓN Y QUESO receta foto"
197,ENDIBIAS RELLENAS DE JUDÍAS VERDES Y BACALAO,endibias-rellenas-de-judias-verdes-y-bacalao,"Verduras, hortalizas y setas",286,0197-endibias-rellenas-de-judias-verdes-y-bacalao.webp,ENDIBIAS RELLENAS DE JUDÍAS VERDES Y BACALAO receta foto
200,ZORONGOLLO EXTREMEÑO,zorongollo-extremeno,"Verduras, hortalizas y setas",291,0200-zorongollo-extremeno.webp,ZORONGOLLO EXTREMEÑO receta foto
201,TOMATES RELLENOS DE FRUTOS DE MAR,tomates-rellenos-de-frutos-de-mar,"Verduras, hortalizas y setas",292,0201-tomates-rellenos-de-frutos-de-mar.webp,TOMATES RELLENOS DE FRUTOS DE MAR receta foto
202,ALCACHOFAS CON ALMEJAS EN VINAGRETA,alcachofas-con-almejas-en-vinagreta,"Verduras, hortalizas y setas",293,0202-alcachofas-con-almejas-en-vinagreta.webp,ALCACHOFAS CON ALMEJAS EN VINAGRETA receta foto
203,BERENJENAS AL HORNO,berenjenas-al-horno,"Verduras, hortalizas y setas",294,0203-berenjenas-al-horno.webp,BERENJENAS AL HORNO receta foto
205,BERENJENAS RELLENAS DE BACALAO,berenjenas-rellenas-de-bacalao,"Verduras, hortalizas y setas",297,0205-berenjenas-rellenas-de-bacalao.webp,BERENJENAS RELLENAS DE BACALAO receta foto
206,BORRAJA CON PATATAS,borraja-con-patatas,"Verduras, hortalizas y setas",298,0206-borraja-con-patatas.webp,BORRAJA CON PATATAS receta foto
208,ACELGAS CON REFRITO DE JAMÓN,acelgas-con-refrito-de-jamon,"Verduras, hortalizas y setas",301,0208-acelgas-con-refrito-de-jamon.webp,ACELGAS CON REFRITO DE JAMÓN receta foto
