id,title,slug,category,source_page,expected_filename,search_query_suggestion
437,VICHYSSOISE,vichyssoise,Sopas y cremas,642,0437-vichyssoise.webp,VICHYSSOISE receta foto
439,SALMOREJO,salmorejo,Sopas y cremas,645,0439-salmorejo.webp,SALMOREJO receta foto
440,CREMA DE TOMATE Y AGUACATE CON GAMBAS CRUJIENTES,crema-de-tomate-y-aguacate-con-gambas-crujientes,Sopas y cremas,646,0440-crema-de-tomate-y-aguacate-con-gambas-crujientes.webp,CREMA DE TOMATE Y AGUACATE CON GAMBAS CRUJIENTES receta foto
442,CREMA DE ALUBIAS CON REJILLA DE PATATAS,crema-de-alubias-con-rejilla-de-patatas,Sopas y cremas,650,0442-crema-de-alubias-con-rejilla-de-patatas.webp,CREMA DE ALUBIAS CON REJILLA DE PATATAS receta foto
444,SOPA DE ARROZ CON VERDURAS Y GAMBAS,sopa-de-arroz-con-verduras-y-gambas,Sopas y cremas,651,0444-sopa-de-arroz-con-verduras-y-gambas.webp,SOPA DE ARROZ CON VERDURAS Y GAMBAS receta foto
446,GAZPACHO DE HABAS,gazpacho-de-habas,Sopas y cremas,655,0446-gazpacho-de-habas.webp,GAZPACHO DE HABAS receta foto
447,CREMA FRÍA DE REMOLACHA,crema-fria-de-remolacha,Sopas y cremas,656,0447-crema-fria-de-remolacha.webp,CREMA FRÍA DE REMOLACHA receta foto
448,SOPA DE BRÓCOLI CON ALMEJAS,sopa-de-brocoli-con-almejas,Sopas y cremas,657,0448-sopa-de-brocoli-con-almejas.webp,SOPA DE BRÓCOLI CON ALMEJAS receta foto
449,CREMA DE LENTEJAS Y CALABAZA CON SORPRESA,crema-de-lentejas-y-calabaza-con-sorpresa,Sopas y cremas,658,0449-crema-de-lentejas-y-calabaza-con-sorpresa.webp,CREMA DE LENTEJAS Y CALABAZA CON SORPRESA receta foto
451,SOPA DE FIDEOS CON PALOMITAS AL CURRY,sopa-de-fideos-con-palomitas-al-curry,Sopas y cremas,662,0451-sopa-de-fideos-con-palomitas-al-curry.webp,SOPA DE FIDEOS CON PALOMITAS AL CURRY receta foto
453,CREMA DE ESPÁRRAGOS CON TRIÁNGULOS DE JAMÓN Y QUESO,crema-de-esparragos-con-triangulos-de-jamon-y-queso,Sopas y cremas,663,0453-crema-de-esparragos-con-triangulos-de-jamon-y-queso.webp,CREMA DE ESPÁRRAGOS CON TRIÁNGULOS DE JAMÓN Y QUESO receta foto
454,CREMA DE GARBANZOS CON FLAUTAS Y LOMBARDA,crema-de-garbanzos-con-flautas-y-lombarda,Sopas y cremas,666,0454-crema-de-garbanzos-con-flautas-y-lombarda.webp,CREMA DE GARBANZOS CON FLAUTAS Y LOMBARDA receta foto
455,SOPA DE BACALAO,sopa-de-bacalao,Sopas y cremas,667,0455-sopa-de-bacalao.webp,SOPA DE BACALAO receta foto
457,SOPA DE PESCADO,sopa-de-pescado,Sopas y cremas,671,0457-sopa-de-pescado.webp,SOPA DE PESCADO receta foto
458,CREMA DE BOLETUS CON SUS BRICKS,crema-de-boletus-con-sus-bricks,Sopas y cremas,672,0458-crema-de-boletus-con-sus-bricks.webp,CREMA DE BOLETUS CON SUS BRICKS receta foto
460,"CREMA DE REMOLACHA, ZANAHORIA Y ALMENDRA",crema-de-remolacha-zanahoria-y-almendra,Sopas y cremas,674,0460-crema-de-remolacha-zanahoria-y-almendra.webp,"CREMA DE REMOLACHA, ZANAHORIA Y ALMENDRA receta foto"
461,SOPA DE POLLO Y TAPIOCA,sopa-de-pollo-y-tapioca,Sopas y cremas,675,0461-sopa-de-pollo-y-tapioca.webp,SOPA DE POLLO Y TAPIOCA receta foto
463,SOPA VIÑA AB,sopa-vina-ab,Sopas y cremas,679,0463-sopa-vina-ab.webp,SOPA VIÑA AB receta foto
464,CREMA DE TOMATE ASADO CON GALLETAS SALADAS,crema-de-tomate-asado-con-galletas-saladas,Sopas y cremas,680,0464-crema-de-tomate-asado-con-galletas-saladas.webp,CREMA DE TOMATE ASADO CON GALLETAS SALADAS receta foto
467,SOPA CASTELLANA,sopa-castellana,Sopas y cremas,685,0467-sopa-castellana.webp,SOPA CASTELLANA receta foto
468,CREMA DE PUERROS CON BOLITAS DE CALABAZA,crema-de-puerros-con-bolitas-de-calabaza,Sopas y cremas,686,0468-crema-de-puerros-con-bolitas-de-calabaza.webp,CREMA DE PUERROS CON BOLITAS DE CALABAZA receta foto
469,SOPA DE CALABAZA CON VERDURAS,sopa-de-calabaza-con-verduras,Sopas y cremas,687,0469-sopa-de-calabaza-con-verduras.webp,SOPA DE CALABAZA CON VERDURAS receta foto
470,SOPA DE QUINOA,sopa-de-quinoa,Sopas y cremas,688,0470-sopa-de-quinoa.webp,SOPA DE QUINOA receta foto
472,SOPA SERRANA,sopa-serrana,Sopas y cremas,690,0472-sopa-serrana.webp,SOPA SERRANA receta foto
473,SOPA DE AJO,sopa-de-ajo,Sopas y cremas,691,0473-sopa-de-ajo.webp,SOPA DE AJO receta foto
476,CREMA DE LENTEJAS CON MEDALLONES DE CORDERO,crema-de-lentejas-con-medallones-de-cordero,Sopas y cremas,696,0476-crema-de-lentejas-con-medallones-de-cordero.webp,CREMA DE LENTEJAS CON MEDALLONES DE CORDERO receta foto
477,GAZPACHO DE TOMATE Y CEREZAS,gazpacho-de-tomate-y-cerezas,Sopas y cremas,698,0477-gazpacho-de-tomate-y-cerezas.webp,GAZPACHO DE TOMATE Y CEREZAS receta foto
478,VICHYSSOISE DE GUISANTES CON SU GUARNICIÓN,vichyssoise-de-guisantes-con-su-guarnicion,Sopas y cremas,699,0478-vichyssoise-de-guisantes-con-su-guarnicion.webp,VICHYSSOISE DE GUISANTES CON SU GUARNICIÓN receta foto
481,CREMA DE CHIRIVÍA CON TORTITAS DE SÉSAMO,crema-de-chirivia-con-tortitas-de-sesamo,Sopas y cremas,704,0481-crema-de-chirivia-con-tortitas-de-sesamo.webp,CREMA DE CHIRIVÍA CON TORTITAS DE SÉSAMO receta foto
482,HUEVOS ROTOS CON FOIE Y SALSA PÉRIGOURDINE,huevos-rotos-con-foie-y-salsa-perigourdine,Huevos,708,0482-huevos-rotos-con-foie-y-salsa-perigourdine.webp,HUEVOS ROTOS CON FOIE Y SALSA PÉRIGOURDINE receta foto
483,HUEVO CON PATATA Y MORCILLA,huevo-con-patata-y-morcilla,Huevos,709,0483-huevo-con-patata-y-morcilla.webp,HUEVO CON PATATA Y MORCILLA receta foto
485,ROLLITOS DE TORTILLA CON QUESO Y JAMÓN,rollitos-de-tortilla-con-queso-y-jamon,Huevos,712,0485-rollitos-de-tortilla-con-queso-y-jamon.webp,ROLLITOS DE TORTILLA CON QUESO Y JAMÓN receta foto
486,CESTOS DE PAN Y HUEVO CON SABAYÓN DE TXAKOLI,cestos-de-pan-y-huevo-con-sabayon-de-txakoli,Huevos,713,0486-cestos-de-pan-y-huevo-con-sabayon-de-txakoli.webp,CESTOS DE PAN Y HUEVO CON SABAYÓN DE TXAKOLI receta foto
489,HUEVO FRITO CON POLENTA DE CHAMPIÑONES AL CURRY,huevo-frito-con-polenta-de-champinones-al-curry,Huevos,719,0489-huevo-frito-con-polenta-de-champinones-al-curry.webp,HUEVO FRITO CON POLENTA DE CHAMPIÑONES AL CURRY receta foto
490,"HUEVO TRUFADO CON PATATAS, JAMÓN Y CIGALITAS",huevo-trufado-con-patatas-jamon-y-cigalitas,Huevos,720,0490-huevo-trufado-con-patatas-jamon-y-cigalitas.webp,"HUEVO TRUFADO CON PATATAS, JAMÓN Y CIGALITAS receta foto"
491,REVUELTO DE BERENJENAS Y SETAS CON POLENTA,revuelto-de-berenjenas-y-setas-con-polenta,Huevos,721,0491-revuelto-de-berenjenas-y-setas-con-polenta.webp,REVUELTO DE BERENJENAS Y SETAS CON POLENTA receta foto
492,TORTILLA DE VERDURAS EN HOGAZA,tortilla-de-verduras-en-hogaza,Huevos,721,0492-tortilla-de-verduras-en-hogaza.webp,TORTILLA DE VERDURAS EN HOGAZA receta foto
495,REVUELTO DE PERRETXIKOS CON ENSALADA,revuelto-de-perretxikos-con-ensalada,Huevos,728,0495-revuelto-de-perretxikos-con-ensalada.webp,REVUELTO DE PERRETXIKOS CON ENSALADA receta foto
496,CREPES DE TXISTORRA CON HUEVO FRITO Y AROS DE CEBOLLA,crepes-de-txistorra-con-huevo-frito-y-aros-de-cebolla,Huevos,728,0496-crepes-de-txistorra-con-huevo-frito-y-aros-de-cebolla.webp,CREPES DE TXISTORRA CON HUEVO FRITO Y AROS DE CEBOLLA receta foto
497,TORTILLA DE PESCADILLA CON SALSA DE PIMIENTO VERDE,tortilla-de-pescadilla-con-salsa-de-pimiento-verde,Huevos,730,0497-tortilla-de-pescadilla-con-salsa-de-pimiento-verde.webp,TORTILLA DE PESCADILLA CON SALSA DE PIMIENTO VERDE receta foto
498,JAMÓN RELLENO DE TORTILLA Y QUESO,jamon-relleno-de-tortilla-y-queso,Huevos,730,0498-jamon-relleno-de-tortilla-y-queso.webp,JAMÓN RELLENO DE TORTILLA Y QUESO receta foto
500,CAZUELITAS DE HUEVOS ESCONDIDOS,cazuelitas-de-huevos-escondidos,Huevos,734,0500-cazuelitas-de-huevos-escondidos.webp,CAZUELITAS DE HUEVOS ESCONDIDOS receta foto
501,HUEVOS A LA CAZUELA,huevos-a-la-cazuela,Huevos,734,0501-huevos-a-la-cazuela.webp,HUEVOS A LA CAZUELA receta foto
504,HUEVOS AL NIDO,huevos-al-nido,Huevos,740,0504-huevos-al-nido.webp,HUEVOS AL NIDO receta foto
505,HUEVOS CON SALSA BRETONA,huevos-con-salsa-bretona,Huevos,740,0505-huevos-con-salsa-bretona.webp,HUEVOS CON SALSA BRETONA receta foto
506,HUEVOS ESCALFADOS CON GUISANTES Y PAN FRITO,huevos-escalfados-con-guisantes-y-pan-frito,Huevos,741,0506-huevos-escalfados-con-guisantes-y-pan-frito.webp,HUEVOS ESCALFADOS CON GUISANTES Y PAN FRITO receta foto
507,HUEVOS ESCALFADOS A LA FLORENTINA,huevos-escalfados-a-la-florentina,Huevos,742,0507-huevos-escalfados-a-la-florentina.webp,HUEVOS ESCALFADOS A LA FLORENTINA receta foto
509,MILHOJAS DE TORTILLA,milhojas-de-tortilla,Huevos,745,0509-milhojas-de-tortilla.webp,MILHOJAS DE TORTILLA receta foto
510,REVUELTO DE ESPÁRRAGOS Y BEICON,revuelto-de-esparragos-y-beicon,Huevos,746,0510-revuelto-de-esparragos-y-beicon.webp,REVUELTO DE ESPÁRRAGOS Y BEICON receta foto
512,"REVUELTO DE PATATAS, PIMIENTOS Y JAMÓN",revuelto-de-patatas-pimientos-y-jamon,Huevos,749,0512-revuelto-de-patatas-pimientos-y-jamon.webp,"REVUELTO DE PATATAS, PIMIENTOS Y JAMÓN receta foto"
513,REVUELTO DE PISTO,revuelto-de-pisto,Huevos,750,0513-revuelto-de-pisto.webp,REVUELTO DE PISTO receta foto
515,REVUELTO DE VERDURAS,revuelto-de-verduras,Huevos,754,0515-revuelto-de-verduras.webp,REVUELTO DE VERDURAS receta foto
516,TORTILLA DE CALABACINES,tortilla-de-calabacines,Huevos,754,0516-tortilla-de-calabacines.webp,TORTILLA DE CALABACINES receta foto
518,TORTILLA DE ROPA VIEJA,tortilla-de-ropa-vieja,Huevos,758,0518-tortilla-de-ropa-vieja.webp,TORTILLA DE ROPA VIEJA receta foto
521,SABORES DE SORIA EN CAZUELA,sabores-de-soria-en-cazuela,Huevos,763,0521-sabores-de-soria-en-cazuela.webp,SABORES DE SORIA EN CAZUELA receta foto
522,CHULETA RELLENA CON MERMELADA DE CEBOLLA,chuleta-rellena-con-mermelada-de-cebolla,Carnes y aves,766,0522-chuleta-rellena-con-mermelada-de-cebolla.webp,CHULETA RELLENA CON MERMELADA DE CEBOLLA receta foto
523,COSTILLA DE TERNERA CON ZUMO DE UVA,costilla-de-ternera-con-zumo-de-uva,Carnes y aves,767,0523-costilla-de-ternera-con-zumo-de-uva.webp,COSTILLA DE TERNERA CON ZUMO DE UVA receta foto
526,BOCADO DE LA REINA CON PATATAS AL ROMERO Y SALSA DULCE,bocado-de-la-reina-con-patatas-al-romero-y-salsa-dulce,Carnes y aves,772,0526-bocado-de-la-reina-con-patatas-al-romero-y-salsa-dulce.webp,BOCADO DE LA REINA CON PATATAS AL ROMERO Y SALSA DULCE receta foto
527,JAMÓN CON SALSA DE CEBOLLA Y PIÑA ASADA,jamon-con-salsa-de-cebolla-y-pina-asada,Carnes y aves,773,0527-jamon-con-salsa-de-cebolla-y-pina-asada.webp,JAMÓN CON SALSA DE CEBOLLA Y PIÑA ASADA receta foto
528,CERDO CON VERDURAS Y SALSA AGRIDULCE,cerdo-con-verduras-y-salsa-agridulce,Carnes y aves,774,0528-cerdo-con-verduras-y-salsa-agridulce.webp,CERDO CON VERDURAS Y SALSA AGRIDULCE receta foto
530,BROCHETA DE PRESA Y TOMATITOS,brocheta-de-presa-y-tomatitos,Carnes y aves,777,0530-brocheta-de-presa-y-tomatitos.webp,BROCHETA DE PRESA Y TOMATITOS receta foto
532,CONEJO CON ARROZ VERDE CREMOSO,conejo-con-arroz-verde-cremoso,Carnes y aves,781,0532-conejo-con-arroz-verde-cremoso.webp,CONEJO CON ARROZ VERDE CREMOSO receta foto
533,FILETES RELLENOS CON PLÁTANO,filetes-rellenos-con-platano,Carnes y aves,782,0533-filetes-rellenos-con-platano.webp,FILETES RELLENOS CON PLÁTANO receta foto
534,RABO DE NOVILLO AL CAVA CON GUISANTES,rabo-de-novillo-al-cava-con-guisantes,Carnes y aves,783,0534-rabo-de-novillo-al-cava-con-guisantes.webp,RABO DE NOVILLO AL CAVA CON GUISANTES receta foto
535,CONEJO CON GARBANZOS,conejo-con-garbanzos,Carnes y aves,784,0535-conejo-con-garbanzos.webp,CONEJO CON GARBANZOS receta foto
537,CREPES DE SOLOMILLO INGLÉS Y QUESO ROQUEFORT,crepes-de-solomillo-ingles-y-queso-roquefort,Carnes y aves,788,0537-crepes-de-solomillo-ingles-y-queso-roquefort.webp,CREPES DE SOLOMILLO INGLÉS Y QUESO ROQUEFORT receta foto
538,BRICK DE CONEJO Y PISTO DE CALABACÍN,brick-de-conejo-y-pisto-de-calabacin,Carnes y aves,789,0538-brick-de-conejo-y-pisto-de-calabacin.webp,BRICK DE CONEJO Y PISTO DE CALABACÍN receta foto
540,"TACO DE TERNERA, VERDURAS Y QUESO CON SALSA PICANTE",taco-de-ternera-verduras-y-queso-con-salsa-picante,Carnes y aves,792,0540-taco-de-ternera-verduras-y-queso-con-salsa-picante.webp,"TACO DE TERNERA, VERDURAS Y QUESO CON SALSA PICANTE receta foto"
541,TERRINA DE CARNE PICADA Y PLÁTANO,terrina-de-carne-picada-y-platano,Carnes y aves,793,0541-terrina-de-carne-picada-y-platano.webp,TERRINA DE CARNE PICADA Y PLÁTANO receta foto
544,SOLOMILLO DE CERDO CON GAJOS DE MANZANA ENVUELTOS CON HOJALDRE,solomillo-de-cerdo-con-gajos-de-manzana-envueltos-con-hojaldre,Carnes y aves,800,0544-solomillo-de-cerdo-con-gajos-de-manzana-envueltos-con-hojaldre.webp,SOLOMILLO DE CERDO CON GAJOS DE MANZANA ENVUELTOS CON HOJALDRE receta foto
545,REDONDO REBOZADO CON BROCHETA DE PLÁTANO,redondo-rebozado-con-brocheta-de-platano,Carnes y aves,801,0545-redondo-rebozado-con-brocheta-de-platano.webp,REDONDO REBOZADO CON BROCHETA DE PLÁTANO receta foto
546,BOCADO DE LA REINA CON SALSA DE VINO TINTO Y CHALOTAS,bocado-de-la-reina-con-salsa-de-vino-tinto-y-chalotas,Carnes y aves,802,0546-bocado-de-la-reina-con-salsa-de-vino-tinto-y-chalotas.webp,BOCADO DE LA REINA CON SALSA DE VINO TINTO Y CHALOTAS receta foto
547,CONEJO EN CHULETILLAS CON FIDEOS CHINOS,conejo-en-chuletillas-con-fideos-chinos,Carnes y aves,803,0547-conejo-en-chuletillas-con-fideos-chinos.webp,CONEJO EN CHULETILLAS CON FIDEOS CHINOS receta foto
550,CHULETAS DE SAJONIA CON SALSA DE NARANJA Y OREJONES ASADOS,chuletas-de-sajonia-con-salsa-de-naranja-y-orejones-asados,Carnes y aves,810,0550-chuletas-de-sajonia-con-salsa-de-naranja-y-orejones-asados.webp,CHULETAS DE SAJONIA CON SALSA DE NARANJA Y OREJONES ASADOS receta foto
551,ALBÓNDIGAS EN SALSA DE MANZANA Y ARROZ INTEGRAL,albondigas-en-salsa-de-manzana-y-arroz-integral,Carnes y aves,811,0551-albondigas-en-salsa-de-manzana-y-arroz-integral.webp,ALBÓNDIGAS EN SALSA DE MANZANA Y ARROZ INTEGRAL receta foto
552,SANJACOBOS DE LENGUA CON SALSA DE TXAKOLI,sanjacobos-de-lengua-con-salsa-de-txakoli,Carnes y aves,812,0552-sanjacobos-de-lengua-con-salsa-de-txakoli.webp,SANJACOBOS DE LENGUA CON SALSA DE TXAKOLI receta foto
553,BOCADOS DE LOMO Y JAMÓN,bocados-de-lomo-y-jamon,Carnes y aves,813,0553-bocados-de-lomo-y-jamon.webp,BOCADOS DE LOMO Y JAMÓN receta foto
555,COSTILLA DE TERNERA CON CHALOTAS Y SALSA DE CEBOLLA,costilla-de-ternera-con-chalotas-y-salsa-de-cebolla,Carnes y aves,817,0555-costilla-de-ternera-con-chalotas-y-salsa-de-cebolla.webp,COSTILLA DE TERNERA CON CHALOTAS Y SALSA DE CEBOLLA receta foto
556,HAMBURGUESAS RELLENAS,hamburguesas-rellenas,Carnes y aves,818,0556-hamburguesas-rellenas.webp,HAMBURGUESAS RELLENAS receta foto
559,CODILLO CON CHUCRUT Y PURÉ DE PATATA,codillo-con-chucrut-y-pure-de-patata,Carnes y aves,824,0559-codillo-con-chucrut-y-pure-de-patata.webp,CODILLO CON CHUCRUT Y PURÉ DE PATATA receta foto
560,ENTRECOT CON VERDURAS EN TEMPURA,entrecot-con-verduras-en-tempura,Carnes y aves,824,0560-entrecot-con-verduras-en-tempura.webp,ENTRECOT CON VERDURAS EN TEMPURA receta foto
561,MINIHAMBURGUESAS CON SALSA BARBACOA,minihamburguesas-con-salsa-barbacoa,Carnes y aves,825,0561-minihamburguesas-con-salsa-barbacoa.webp,MINIHAMBURGUESAS CON SALSA BARBACOA receta foto
563,"TERNERA RELLENA CON LOMBARDA, MANZANA Y BEICON",ternera-rellena-con-lombarda-manzana-y-beicon,Carnes y aves,828,0563-ternera-rellena-con-lombarda-manzana-y-beicon.webp,"TERNERA RELLENA CON LOMBARDA, MANZANA Y BEICON receta foto"
565,HAMBURGUESA EN HOJALDRE,hamburguesa-en-hojaldre,Carnes y aves,832,0565-hamburguesa-en-hojaldre.webp,HAMBURGUESA EN HOJALDRE receta foto
566,LOMO A LA CANELA CON POLENTA DE MANZANA Y CIRUELAS,lomo-a-la-canela-con-polenta-de-manzana-y-ciruelas,Carnes y aves,833,0566-lomo-a-la-canela-con-polenta-de-manzana-y-ciruelas.webp,LOMO A LA CANELA CON POLENTA DE MANZANA Y CIRUELAS receta foto
567,ALBÓNDIGAS RELLENAS CON SALSA DE CEBOLLETA,albondigas-rellenas-con-salsa-de-cebolleta,Carnes y aves,834,0567-albondigas-rellenas-con-salsa-de-cebolleta.webp,ALBÓNDIGAS RELLENAS CON SALSA DE CEBOLLETA receta foto
568,PINCHOS DE CERDO CON ARROZ,pinchos-de-cerdo-con-arroz,Carnes y aves,835,0568-pinchos-de-cerdo-con-arroz.webp,PINCHOS DE CERDO CON ARROZ receta foto
570,ALETA RELLENA DE JAMÓN Y PERAS CON BOLETUS,aleta-rellena-de-jamon-y-peras-con-boletus,Carnes y aves,839,0570-aleta-rellena-de-jamon-y-peras-con-boletus.webp,ALETA RELLENA DE JAMÓN Y PERAS CON BOLETUS receta foto
571,SOLOMILLO WELLINGTON,solomillo-wellington,Carnes y aves,840,0571-solomillo-wellington.webp,SOLOMILLO WELLINGTON receta foto
574,HAMBURGUESA CON CHAMPIÑONES EN SALSA,hamburguesa-con-champinones-en-salsa,Carnes y aves,845,0574-hamburguesa-con-champinones-en-salsa.webp,HAMBURGUESA CON CHAMPIÑONES EN SALSA receta foto
575,HOJALDRE DE CONEJO Y CHAMPIÑONES,hojaldre-de-conejo-y-champinones,Carnes y aves,846,0575-hojaldre-de-conejo-y-champinones.webp,HOJALDRE DE CONEJO Y CHAMPIÑONES receta foto
576,ESPALDILLA ASADA CON PIMIENTOS Y CEBOLLETA,espaldilla-asada-con-pimientos-y-cebolleta,Carnes y aves,847,0576-espaldilla-asada-con-pimientos-y-cebolleta.webp,ESPALDILLA ASADA CON PIMIENTOS Y CEBOLLETA receta foto
577,RIÑONES ENCEBOLLADOS CON PURÉ DE PATATA AL PIMENTÓN,rinones-encebollados-con-pure-de-patata-al-pimenton,Carnes y aves,848,0577-rinones-encebollados-con-pure-de-patata-al-pimenton.webp,RIÑONES ENCEBOLLADOS CON PURÉ DE PATATA AL PIMENTÓN receta foto
580,MORROS DE TERNERA CON SALSA VIZCAÍNA,morros-de-ternera-con-salsa-vizcaina,Carnes y aves,853,0580-morros-de-ternera-con-salsa-vizcaina.webp,MORROS DE TERNERA CON SALSA VIZCAÍNA receta foto
581,CARNE PICADA CON BECHAMEL GRATINADA,carne-picada-con-bechamel-gratinada,Carnes y aves,854,0581-carne-picada-con-bechamel-gratinada.webp,CARNE PICADA CON BECHAMEL GRATINADA receta foto
582,PIERNA DE CORDERO A LA MIEL,pierna-de-cordero-a-la-miel,Carnes y aves,855,0582-pierna-de-cordero-a-la-miel.webp,PIERNA DE CORDERO A LA MIEL receta foto
584,PATORRILLO,patorrillo,Carnes y aves,858,0584-patorrillo.webp,PATORRILLO receta foto
586,CARNE GUISADA CON PATATAS,carne-guisada-con-patatas,Carnes y aves,862,0586-carne-guisada-con-patatas.webp,CARNE GUISADA CON PATATAS receta foto
587,CUSCÚS CON CONEJO Y NARANJA,cuscus-con-conejo-y-naranja,Carnes y aves,862,0587-cuscus-con-conejo-y-naranja.webp,CUSCÚS CON CONEJO Y NARANJA receta foto
588,CODILLO CON REPOLLO,codillo-con-repollo,Carnes y aves,863,0588-codillo-con-repollo.webp,CODILLO CON REPOLLO receta foto
589,ATADITO DE COCHINILLO CON DÁTILES RELLENOS,atadito-de-cochinillo-con-datiles-rellenos,Carnes y aves,864,0589-atadito-de-cochinillo-con-datiles-rellenos.webp,ATADITO DE COCHINILLO CON DÁTILES RELLENOS receta foto
592,"MOLLEJAS DE CORDERO CON LOMBARDA, MANZANA Y PASAS",mollejas-de-cordero-con-lombarda-manzana-y-pasas,Carnes y aves,870,0592-mollejas-de-cordero-con-lombarda-manzana-y-pasas.webp,"MOLLEJAS DE CORDERO CON LOMBARDA, MANZANA Y PASAS receta foto"
593,CARRILLERAS DE CERDO AL VINO TINTO,carrilleras-de-cerdo-al-vino-tinto,Carnes y aves,871,0593-carrilleras-de-cerdo-al-vino-tinto.webp,CARRILLERAS DE CERDO AL VINO TINTO receta foto
594,LENGUA EN SALSA VERDE,lengua-en-salsa-verde,Carnes y aves,872,0594-lengua-en-salsa-verde.webp,LENGUA EN SALSA VERDE receta foto
595,"VILLEROY DE REDONDO, JAMÓN DE PAVO Y QUESO",villeroy-de-redondo-jamon-de-pavo-y-queso,Carnes y aves,873,0595-villeroy-de-redondo-jamon-de-pavo-y-queso.webp,"VILLEROY DE REDONDO, JAMÓN DE PAVO Y QUESO receta foto"
598,MANITAS DE CERDO CON CIRUELAS,manitas-de-cerdo-con-ciruelas,Carnes y aves,878,0598-manitas-de-cerdo-con-ciruelas.webp,MANITAS DE CERDO CON CIRUELAS receta foto
599,ALBÓNDIGAS CON PURÉ DE PATATA,albondigas-con-pure-de-patata,Carnes y aves,879,0599-albondigas-con-pure-de-patata.webp,ALBÓNDIGAS CON PURÉ DE PATATA receta foto
600,BROCHETAS DE SOLOMILLO Y MELÓN CON ENSALADA DE RÚCULA,brochetas-de-solomillo-y-melon-con-ensalada-de-rucula,Carnes y aves,880,0600-brochetas-de-solomillo-y-melon-con-ensalada-de-rucula.webp,BROCHETAS DE SOLOMILLO Y MELÓN CON ENSALADA DE RÚCULA receta foto
601,CARRILLERAS DE TERNERA CON PURÉ DE PATATAS Y SETAS,carrilleras-de-ternera-con-pure-de-patatas-y-setas,Carnes y aves,881,0601-carrilleras-de-ternera-con-pure-de-patatas-y-setas.webp,CARRILLERAS DE TERNERA CON PURÉ DE PATATAS Y SETAS receta foto
602,CARRILLERAS DE TERNERA CON POLENTA,carrilleras-de-ternera-con-polenta,Carnes y aves,882,0602-carrilleras-de-ternera-con-polenta.webp,CARRILLERAS DE TERNERA CON POLENTA receta foto
605,MUSLOS DE CONEJO CON PATATAS PANADERA,muslos-de-conejo-con-patatas-panadera,Carnes y aves,890,0605-muslos-de-conejo-con-patatas-panadera.webp,MUSLOS DE CONEJO CON PATATAS PANADERA receta foto
606,RANCHO ARAGONÉS,rancho-aragones,Carnes y aves,891,0606-rancho-aragones.webp,RANCHO ARAGONÉS receta foto
607,CONEJO EN SALSA CON SU HÍGADO,conejo-en-salsa-con-su-higado,Carnes y aves,891,0607-conejo-en-salsa-con-su-higado.webp,CONEJO EN SALSA CON SU HÍGADO receta foto
608,SOLOMILLO DE CERDO CON SALSA DE SETAS,solomillo-de-cerdo-con-salsa-de-setas,Carnes y aves,892,0608-solomillo-de-cerdo-con-salsa-de-setas.webp,SOLOMILLO DE CERDO CON SALSA DE SETAS receta foto
611,RELLENO NAVARRO,relleno-navarro,Carnes y aves,899,0611-relleno-navarro.webp,RELLENO NAVARRO receta foto
612,FILETES DE REDONDO CON ENSALADA Y COLES DE BRUSELAS,filetes-de-redondo-con-ensalada-y-coles-de-bruselas,Carnes y aves,900,0612-filetes-de-redondo-con-ensalada-y-coles-de-bruselas.webp,FILETES DE REDONDO CON ENSALADA Y COLES DE BRUSELAS receta foto
613,RABO EN SALSA DE VINO TINTO Y CHOCOLATE,rabo-en-salsa-de-vino-tinto-y-chocolate,Carnes y aves,901,0613-rabo-en-salsa-de-vino-tinto-y-chocolate.webp,RABO EN SALSA DE VINO TINTO Y CHOCOLATE receta foto
616,LONGANIZA CON PURÉ DE PATATAS Y SALSA PICANTE,longaniza-con-pure-de-patatas-y-salsa-picante,Carnes y aves,906,0616-longaniza-con-pure-de-patatas-y-salsa-picante.webp,LONGANIZA CON PURÉ DE PATATAS Y SALSA PICANTE receta foto
617,CONEJO EN SALSA DE ALMENDRAS,conejo-en-salsa-de-almendras,Carnes y aves,907,0617-conejo-en-salsa-de-almendras.webp,CONEJO EN SALSA DE ALMENDRAS receta foto
618,FALDA CON PATATAS COCIDAS,falda-con-patatas-cocidas,Carnes y aves,908,0618-falda-con-patatas-cocidas.webp,FALDA CON PATATAS COCIDAS receta foto
619,CABRITO GUISADO AL ESTILO DE LEÓN,cabrito-guisado-al-estilo-de-leon,Carnes y aves,909,0619-cabrito-guisado-al-estilo-de-leon.webp,CABRITO GUISADO AL ESTILO DE LEÓN receta foto
622,SANCOCHO DOMINICANO,sancocho-dominicano,Carnes y aves,916,0622-sancocho-dominicano.webp,SANCOCHO DOMINICANO receta foto
623,REDONDO EN SALSA DE CERVEZA NEGRA,redondo-en-salsa-de-cerveza-negra,Carnes y aves,917,0623-redondo-en-salsa-de-cerveza-negra.webp,REDONDO EN SALSA DE CERVEZA NEGRA receta foto
624,"BOCADILLO DE LENGUA, PIMIENTOS VERDES Y CHALOTAS",bocadillo-de-lengua-pimientos-verdes-y-chalotas,Carnes y aves,918,0624-bocadillo-de-lengua-pimientos-verdes-y-chalotas.webp,"BOCADILLO DE LENGUA, PIMIENTOS VERDES Y CHALOTAS receta foto"
625,JAMÓN FRESCO CON MELÓN,jamon-fresco-con-melon,Carnes y aves,919,0625-jamon-fresco-con-melon.webp,JAMÓN FRESCO CON MELÓN receta foto
628,PATÉ DE CAMPAÑA,pate-de-campana,Carnes y aves,924,0628-pate-de-campana.webp,PATÉ DE CAMPAÑA receta foto
629,POLLO ASADO CON PISTO DE CHAMPIÑONES Y CUSCÚS,pollo-asado-con-pisto-de-champinones-y-cuscus,Carnes y aves,925,0629-pollo-asado-con-pisto-de-champinones-y-cuscus.webp,POLLO ASADO CON PISTO DE CHAMPIÑONES Y CUSCÚS receta foto
630,ALBÓNDIGAS DE PAVO CON PURÉ DE CÍTRICOS,albondigas-de-pavo-con-pure-de-citricos,Carnes y aves,927,0630-albondigas-de-pavo-con-pure-de-citricos.webp,ALBÓNDIGAS DE PAVO CON PURÉ DE CÍTRICOS receta foto
631,PATO ASADO CON UVAS,pato-asado-con-uvas,Carnes y aves,928,0631-pato-asado-con-uvas.webp,PATO ASADO CON UVAS receta foto
634,ALITAS ASADAS CON FIDEOS Y VERDURAS,alitas-asadas-con-fideos-y-verduras,Carnes y aves,933,0634-alitas-asadas-con-fideos-y-verduras.webp,ALITAS ASADAS CON FIDEOS Y VERDURAS receta foto
635,PASTELITOS DE PAVO CON BRÓCOLI,pastelitos-de-pavo-con-brocoli,Carnes y aves,934,0635-pastelitos-de-pavo-con-brocoli.webp,PASTELITOS DE PAVO CON BRÓCOLI receta foto
636,ALBÓNDIGAS DE PAVO CON QUESO FRITO,albondigas-de-pavo-con-queso-frito,Carnes y aves,935,0636-albondigas-de-pavo-con-queso-frito.webp,ALBÓNDIGAS DE PAVO CON QUESO FRITO receta foto
637,HIGADILLOS DE POLLO CON GARBANZOS,higadillos-de-pollo-con-garbanzos,Carnes y aves,937,0637-higadillos-de-pollo-con-garbanzos.webp,HIGADILLOS DE POLLO CON GARBANZOS receta foto
640,ROLLITOS DE PAVO CON QUESO FRESCO Y ESPÁRRAGOS,rollitos-de-pavo-con-queso-fresco-y-esparragos,Carnes y aves,942,0640-rollitos-de-pavo-con-queso-fresco-y-esparragos.webp,ROLLITOS DE PAVO CON QUESO FRESCO Y ESPÁRRAGOS receta foto
641,POLLO CON SALSA DE FRUTAS PASAS Y PASTA,pollo-con-salsa-de-frutas-pasas-y-pasta,Carnes y aves,943,0641-pollo-con-salsa-de-frutas-pasas-y-pasta.webp,POLLO CON SALSA DE FRUTAS PASAS Y PASTA receta foto
642,PECHUGA DE PATO CON ESPÁRRAGOS EN TEMPURA DE AZAFRÁN,pechuga-de-pato-con-esparragos-en-tempura-de-azafran,Carnes y aves,944,0642-pechuga-de-pato-con-esparragos-en-tempura-de-azafran.webp,PECHUGA DE PATO CON ESPÁRRAGOS EN TEMPURA DE AZAFRÁN receta foto
643,HAMBURGUESAS DE PAVO CON SORPRESA,hamburguesas-de-pavo-con-sorpresa,Carnes y aves,945,0643-hamburguesas-de-pavo-con-sorpresa.webp,HAMBURGUESAS DE PAVO CON SORPRESA receta foto
646,PECHUGA DE PAVO A LA MOSTAZA CON SU GUARNICIÓN,pechuga-de-pavo-a-la-mostaza-con-su-guarnicion,Carnes y aves,951,0646-pechuga-de-pavo-a-la-mostaza-con-su-guarnicion.webp,PECHUGA DE PAVO A LA MOSTAZA CON SU GUARNICIÓN receta foto
647,ALAS DE POLLO CON CODITOS,alas-de-pollo-con-coditos,Carnes y aves,952,0647-alas-de-pollo-con-coditos.webp,ALAS DE POLLO CON CODITOS receta foto
648,MUSLOS DE POLLO RELLENOS,muslos-de-pollo-rellenos,Carnes y aves,953,0648-muslos-de-pollo-rellenos.webp,MUSLOS DE POLLO RELLENOS receta foto
649,ROLLITOS DE PAVO CON CHAMPIÑONES,rollitos-de-pavo-con-champinones,Carnes y aves,954,0649-rollitos-de-pavo-con-champinones.webp,ROLLITOS DE PAVO CON CHAMPIÑONES receta foto
