id,title,slug,category,source_page,expected_filename,search_query_suggestion
209,CALABACINES RELLENOS DE AJOARRIERO,calabacines-rellenos-de-ajoarriero,"Verduras, hortalizas y setas",302,0209-calabacines-rellenos-de-ajoarriero.webp,CALABACINES RELLENOS DE AJOARRIERO receta foto
211,CARDO CON ALMEJAS Y ALMENDRAS,cardo-con-almejas-y-almendras,"Verduras, hortalizas y setas",305,0211-cardo-con-almejas-y-almendras.webp,CARDO CON ALMEJAS Y ALMENDRAS receta foto
212,PUDIN DE VERDURAS CON CREMA DE CALABAZA,pudin-de-verduras-con-crema-de-calabaza,"Verduras, hortalizas y setas",306,0212-pudin-de-verduras-con-crema-de-calabaza.webp,PUDIN DE VERDURAS CON CREMA DE CALABAZA receta foto
214,MENESTRA DE VERDURAS REBOZADAS,menestra-de-verduras-rebozadas,"Verduras, hortalizas y setas",309,0214-menestra-de-verduras-rebozadas.webp,MENESTRA DE VERDURAS REBOZADAS receta foto
216,"TIMBAL DE PATATAS, HUEVO Y TXISTORRA",timbal-de-patatas-huevo-y-txistorra,"Verduras, hortalizas y setas",311,0216-timbal-de-patatas-huevo-y-txistorra.webp,"TIMBAL DE PATATAS, HUEVO Y TXISTORRA receta foto"
217,ESPINACAS A LA CREMA,espinacas-a-la-crema,"Verduras, hortalizas y setas",313,0217-espinacas-a-la-crema.webp,ESPINACAS A LA CREMA receta foto
218,FLAN DE CALABACÍN Y QUESO,flan-de-calabacin-y-queso,"Verduras, hortalizas y setas",314,0218-flan-de-calabacin-y-queso.webp,FLAN DE CALABACÍN Y QUESO receta foto
221,ALCACHOFAS CON CREMA DE CALABAZA,alcachofas-con-crema-de-calabaza,"Verduras, hortalizas y setas",320,0221-alcachofas-con-crema-de-calabaza.webp,ALCACHOFAS CON CREMA DE CALABAZA receta foto
222,ACELGAS CON ANCHOAS Y HUEVO ESCALFADO,acelgas-con-anchoas-y-huevo-escalfado,"Verduras, hortalizas y setas",321,0222-acelgas-con-anchoas-y-huevo-escalfado.webp,ACELGAS CON ANCHOAS Y HUEVO ESCALFADO receta foto
223,COCIDO DE GARBANZOS,cocido-de-garbanzos,Legumbres,324,0223-cocido-de-garbanzos.webp,COCIDO DE GARBANZOS receta foto
224,LENTEJAS CON ESPINACAS,lentejas-con-espinacas,Legumbres,326,0224-lentejas-con-espinacas.webp,LENTEJAS CON ESPINACAS receta foto
227,ALUBIAS BLANCAS CON CUELLO DE CORDERO,alubias-blancas-con-cuello-de-cordero,Legumbres,330,0227-alubias-blancas-con-cuello-de-cordero.webp,ALUBIAS BLANCAS CON CUELLO DE CORDERO receta foto
228,HUMMUS CON TORTILLAS FRITAS Y BASTONES DE ZANAHORIA,hummus-con-tortillas-fritas-y-bastones-de-zanahoria,Legumbres,331,0228-hummus-con-tortillas-fritas-y-bastones-de-zanahoria.webp,HUMMUS CON TORTILLAS FRITAS Y BASTONES DE ZANAHORIA receta foto
229,ALUBIAS BLANCAS CON SALCHICHAS,alubias-blancas-con-salchichas,Legumbres,332,0229-alubias-blancas-con-salchichas.webp,ALUBIAS BLANCAS CON SALCHICHAS receta foto
230,ALUBIAS BLANCAS CON PATATAS Y COLES DE BRUSELAS,alubias-blancas-con-patatas-y-coles-de-bruselas,Legumbres,333,0230-alubias-blancas-con-patatas-y-coles-de-bruselas.webp,ALUBIAS BLANCAS CON PATATAS Y COLES DE BRUSELAS receta foto
232,ALUBIAS BLANCAS CON BUÑUELOS DE CALABACÍN Y ESPINACAS,alubias-blancas-con-bunuelos-de-calabacin-y-espinacas,Legumbres,336,0232-alubias-blancas-con-bunuelos-de-calabacin-y-espinacas.webp,ALUBIAS BLANCAS CON BUÑUELOS DE CALABACÍN Y ESPINACAS receta foto
233,PISTO DE GARBANZOS Y OREJA,pisto-de-garbanzos-y-oreja,Legumbres,337,0233-pisto-de-garbanzos-y-oreja.webp,PISTO DE GARBANZOS Y OREJA receta foto
235,GARBANZOS CON ACELGAS,garbanzos-con-acelgas,Legumbres,341,0235-garbanzos-con-acelgas.webp,GARBANZOS CON ACELGAS receta foto
236,LENTEJAS CON CALABACÍN Y MORCILLA DE ARROZ,lentejas-con-calabacin-y-morcilla-de-arroz,Legumbres,341,0236-lentejas-con-calabacin-y-morcilla-de-arroz.webp,LENTEJAS CON CALABACÍN Y MORCILLA DE ARROZ receta foto
238,ALUBIAS PINTAS CON CONEJO Y SOBRASADA,alubias-pintas-con-conejo-y-sobrasada,Legumbres,345,0238-alubias-pintas-con-conejo-y-sobrasada.webp,ALUBIAS PINTAS CON CONEJO Y SOBRASADA receta foto
239,LENTEJAS CALDOSAS CON ACELGAS Y CHURROS DE TXISTORRA,lentejas-caldosas-con-acelgas-y-churros-de-txistorra,Legumbres,346,0239-lentejas-caldosas-con-acelgas-y-churros-de-txistorra.webp,LENTEJAS CALDOSAS CON ACELGAS Y CHURROS DE TXISTORRA receta foto
242,ALUBIAS BLANCAS CON CHORIZO,alubias-blancas-con-chorizo,Legumbres,350,0242-alubias-blancas-con-chorizo.webp,ALUBIAS BLANCAS CON CHORIZO receta foto
243,GARBANZOS CON GAMBAS,garbanzos-con-gambas,Legumbres,352,0243-garbanzos-con-gambas.webp,GARBANZOS CON GAMBAS receta foto
244,ALUBIAS NEGRAS CON PUERROS EN TEMPURA,alubias-negras-con-puerros-en-tempura,Legumbres,353,0244-alubias-negras-con-puerros-en-tempura.webp,ALUBIAS NEGRAS CON PUERROS EN TEMPURA receta foto
245,GARBANZOS CON VERDURAS E HIGADILLOS DE POLLO,garbanzos-con-verduras-e-higadillos-de-pollo,Legumbres,354,0245-garbanzos-con-verduras-e-higadillos-de-pollo.webp,GARBANZOS CON VERDURAS E HIGADILLOS DE POLLO receta foto
247,ALUBIAS BLANCAS CON CALAMARES,alubias-blancas-con-calamares,Legumbres,358,0247-alubias-blancas-con-calamares.webp,ALUBIAS BLANCAS CON CALAMARES receta foto
248,OLLA DE SAN ANTÓN,olla-de-san-anton,Legumbres,358,0248-olla-de-san-anton.webp,OLLA DE SAN ANTÓN receta foto
250,LENTEJAS CON CARRILLERAS DE CERDO,lentejas-con-carrilleras-de-cerdo,Legumbres,361,0250-lentejas-con-carrilleras-de-cerdo.webp,LENTEJAS CON CARRILLERAS DE CERDO receta foto
251,GARBANZOS CON VERDURAS Y MORCILLA,garbanzos-con-verduras-y-morcilla,Legumbres,362,0251-garbanzos-con-verduras-y-morcilla.webp,GARBANZOS CON VERDURAS Y MORCILLA receta foto
253,GARBANZOS CON VERDURAS Y SALSA DE TOMATE,garbanzos-con-verduras-y-salsa-de-tomate,Legumbres,365,0253-garbanzos-con-verduras-y-salsa-de-tomate.webp,GARBANZOS CON VERDURAS Y SALSA DE TOMATE receta foto
254,ALUBIAS CON REPOLLO,alubias-con-repollo,Legumbres,366,0254-alubias-con-repollo.webp,ALUBIAS CON REPOLLO receta foto
256,ALUBIAS BLANCAS CON PIMIENTOS,alubias-blancas-con-pimientos,Legumbres,369,0256-alubias-blancas-con-pimientos.webp,ALUBIAS BLANCAS CON PIMIENTOS receta foto
257,ALUBIAS BLANCAS CON CUELLO DE PATO,alubias-blancas-con-cuello-de-pato,Legumbres,370,0257-alubias-blancas-con-cuello-de-pato.webp,ALUBIAS BLANCAS CON CUELLO DE PATO receta foto
259,LENTEJAS CON MORCILLA,lentejas-con-morcilla,Legumbres,374,0259-lentejas-con-morcilla.webp,LENTEJAS CON MORCILLA receta foto
260,POCHAS CON CONEJO,pochas-con-conejo,Legumbres,374,0260-pochas-con-conejo.webp,POCHAS CON CONEJO receta foto
262,POCHAS CON ALMEJAS,pochas-con-almejas,Legumbres,378,0262-pochas-con-almejas.webp,POCHAS CON ALMEJAS receta foto
263,ALUBIAS ROJAS A MI MANERA,alubias-rojas-a-mi-manera,Legumbres,378,0263-alubias-rojas-a-mi-manera.webp,ALUBIAS ROJAS A MI MANERA receta foto
265,COCIDO COMPLETO,cocido-completo,Legumbres,382,0265-cocido-completo.webp,COCIDO COMPLETO receta foto
266,GARBANZOS CON PISTO,garbanzos-con-pisto,Legumbres,383,0266-garbanzos-con-pisto.webp,GARBANZOS CON PISTO receta foto
269,FABES CON ALMEJAS,fabes-con-almejas,Legumbres,389,0269-fabes-con-almejas.webp,FABES CON ALMEJAS receta foto
270,POTAJE CANARIO,potaje-canario,Legumbres,389,0270-potaje-canario.webp,POTAJE CANARIO receta foto
271,HABAS CON MORCILLA,habas-con-morcilla,Legumbres,390,0271-habas-con-morcilla.webp,HABAS CON MORCILLA receta foto
272,HABAS CON HUEVO ESCALFADO,habas-con-huevo-escalfado,Legumbres,391,0272-habas-con-huevo-escalfado.webp,HABAS CON HUEVO ESCALFADO receta foto
274,CAZUELA DE GUISANTES Y BUTIFARRA NEGRA,cazuela-de-guisantes-y-butifarra-negra,Legumbres,395,0274-cazuela-de-guisantes-y-butifarra-negra.webp,CAZUELA DE GUISANTES Y BUTIFARRA NEGRA receta foto
275,HABAS CON CEBOLLETA Y BEICON,habas-con-cebolleta-y-beicon,Legumbres,395,0275-habas-con-cebolleta-y-beicon.webp,HABAS CON CEBOLLETA Y BEICON receta foto
277,HABAS SECAS CON PULPO,habas-secas-con-pulpo,Legumbres,399,0277-habas-secas-con-pulpo.webp,HABAS SECAS CON PULPO receta foto
278,LENTEJAS CON CHORIZO DE CALABAZA Y POLENTA,lentejas-con-chorizo-de-calabaza-y-polenta,Legumbres,399,0278-lentejas-con-chorizo-de-calabaza-y-polenta.webp,LENTEJAS CON CHORIZO DE CALABAZA Y POLENTA receta foto
280,SALTEADO DE ARROZ CON POLLO Y LANGOSTINOS,salteado-de-arroz-con-pollo-y-langostinos,Arroces,405,0280-salteado-de-arroz-con-pollo-y-langostinos.webp,SALTEADO DE ARROZ CON POLLO Y LANGOSTINOS receta foto
281,ARROZ CON PICHONES Y SETAS,arroz-con-pichones-y-setas,Arroces,406,0281-arroz-con-pichones-y-setas.webp,ARROZ CON PICHONES Y SETAS receta foto
283,ARROZ CON VERDURAS AL CURRY,arroz-con-verduras-al-curry,Arroces,409,0283-arroz-con-verduras-al-curry.webp,ARROZ CON VERDURAS AL CURRY receta foto
284,ARROZ VERDE CON LANGOSTINOS,arroz-verde-con-langostinos,Arroces,410,0284-arroz-verde-con-langostinos.webp,ARROZ VERDE CON LANGOSTINOS receta foto
286,ARROZ TAILANDÉS,arroz-tailandes,Arroces,414,0286-arroz-tailandes.webp,ARROZ TAILANDÉS receta foto
287,ARROZ CALDOSO CON TEMPURA DE BORRAJA,arroz-caldoso-con-tempura-de-borraja,Arroces,415,0287-arroz-caldoso-con-tempura-de-borraja.webp,ARROZ CALDOSO CON TEMPURA DE BORRAJA receta foto
290,ARROZ CON VERDURAS DE PRIMAVERA AL GRATÉN,arroz-con-verduras-de-primavera-al-graten,Arroces,419,0290-arroz-con-verduras-de-primavera-al-graten.webp,ARROZ CON VERDURAS DE PRIMAVERA AL GRATÉN receta foto
291,ARROZ CON ESPÁRRAGOS VERDES Y CHORIZO,arroz-con-esparragos-verdes-y-chorizo,Arroces,420,0291-arroz-con-esparragos-verdes-y-chorizo.webp,ARROZ CON ESPÁRRAGOS VERDES Y CHORIZO receta foto
292,ARROZ INTEGRAL CON VERDURAS ASADAS,arroz-integral-con-verduras-asadas,Arroces,421,0292-arroz-integral-con-verduras-asadas.webp,ARROZ INTEGRAL CON VERDURAS ASADAS receta foto
293,ARROZ FRITO TRES DELICIAS,arroz-frito-tres-delicias,Arroces,422,0293-arroz-frito-tres-delicias.webp,ARROZ FRITO TRES DELICIAS receta foto
295,ARROZ CON LANGOSTINOS Y ALIOLI DE PEREJIL,arroz-con-langostinos-y-alioli-de-perejil,Arroces,426,0295-arroz-con-langostinos-y-alioli-de-perejil.webp,ARROZ CON LANGOSTINOS Y ALIOLI DE PEREJIL receta foto
296,ARROZ NEGRO CON SEPIA Y ALIOLI DE MORRÓN,arroz-negro-con-sepia-y-alioli-de-morron,Arroces,427,0296-arroz-negro-con-sepia-y-alioli-de-morron.webp,ARROZ NEGRO CON SEPIA Y ALIOLI DE MORRÓN receta foto
298,PAELLA DE PESCADO Y MARISCO,paella-de-pescado-y-marisco,Arroces,430,0298-paella-de-pescado-y-marisco.webp,PAELLA DE PESCADO Y MARISCO receta foto
299,"ARROZ CON POLLO, CERDO Y LANGOSTINOS",arroz-con-pollo-cerdo-y-langostinos,Arroces,431,0299-arroz-con-pollo-cerdo-y-langostinos.webp,"ARROZ CON POLLO, CERDO Y LANGOSTINOS receta foto"
302,ARROZ CON COSTRA,arroz-con-costra,Arroces,436,0302-arroz-con-costra.webp,ARROZ CON COSTRA receta foto
303,ARROZ A LA CUBANA,arroz-a-la-cubana,Arroces,438,0303-arroz-a-la-cubana.webp,ARROZ A LA CUBANA receta foto
304,ARROZ DE MAR,arroz-de-mar,Arroces,438,0304-arroz-de-mar.webp,ARROZ DE MAR receta foto
305,HAMBURGUESAS DE ARROZ Y LENTEJAS,hamburguesas-de-arroz-y-lentejas,Arroces,439,0305-hamburguesas-de-arroz-y-lentejas.webp,HAMBURGUESAS DE ARROZ Y LENTEJAS receta foto
307,ARROZ CON ALMEJAS Y VERDURAS,arroz-con-almejas-y-verduras,Arroces,443,0307-arroz-con-almejas-y-verduras.webp,ARROZ CON ALMEJAS Y VERDURAS receta foto
308,FIDEOS DE ARROZ CON POLLO,fideos-de-arroz-con-pollo,Arroces,444,0308-fideos-de-arroz-con-pollo.webp,FIDEOS DE ARROZ CON POLLO receta foto
311,CHANFAINA SALMANTINA,chanfaina-salmantina,Arroces,448,0311-chanfaina-salmantina.webp,CHANFAINA SALMANTINA receta foto
312,ARROZ CON MEJILLONES EN ESCABECHE,arroz-con-mejillones-en-escabeche,Arroces,449,0312-arroz-con-mejillones-en-escabeche.webp,ARROZ CON MEJILLONES EN ESCABECHE receta foto
313,RISOTTO A LA MILANESA,risotto-a-la-milanesa,Arroces,450,0313-risotto-a-la-milanesa.webp,RISOTTO A LA MILANESA receta foto
314,ARROZ CON CORDERO,arroz-con-cordero,Arroces,451,0314-arroz-con-cordero.webp,ARROZ CON CORDERO receta foto
317,ARROZ CON MUSLOS DE CODORNIZ,arroz-con-muslos-de-codorniz,Arroces,456,0317-arroz-con-muslos-de-codorniz.webp,ARROZ CON MUSLOS DE CODORNIZ receta foto
318,ALBÓNDIGAS DE ARROZ CON GAMBAS,albondigas-de-arroz-con-gambas,Arroces,458,0318-albondigas-de-arroz-con-gambas.webp,ALBÓNDIGAS DE ARROZ CON GAMBAS receta foto
319,ARROZ A BANDA,arroz-a-banda,Arroces,459,0319-arroz-a-banda.webp,ARROZ A BANDA receta foto
320,ARROZ BLANCO CON UVAS,arroz-blanco-con-uvas,Arroces,460,0320-arroz-blanco-con-uvas.webp,ARROZ BLANCO CON UVAS receta foto
322,ARROZ CON CHAMPIÑONES,arroz-con-champinones,Arroces,464,0322-arroz-con-champinones.webp,ARROZ CON CHAMPIÑONES receta foto
323,ARROZ CON PISTO,arroz-con-pisto,Arroces,465,0323-arroz-con-pisto.webp,ARROZ CON PISTO receta foto
325,EMPEDRAT,empedrat,Arroces,467,0325-empedrat.webp,EMPEDRAT receta foto
326,ARROZ INTEGRAL CON VERDURAS,arroz-integral-con-verduras,Arroces,468,0326-arroz-integral-con-verduras.webp,ARROZ INTEGRAL CON VERDURAS receta foto
329,ARROZ NEGRO CON CALAMARES,arroz-negro-con-calamares,Arroces,472,0329-arroz-negro-con-calamares.webp,ARROZ NEGRO CON CALAMARES receta foto
330,CANELONES DE CARNE CON QUESO FRESCO Y ESPINACAS,canelones-de-carne-con-queso-fresco-y-espinacas,Pastas y masas,477,0330-canelones-de-carne-con-queso-fresco-y-espinacas.webp,CANELONES DE CARNE CON QUESO FRESCO Y ESPINACAS receta foto
331,PASTEL DE MACARRONES,pastel-de-macarrones,Pastas y masas,478,0331-pastel-de-macarrones.webp,PASTEL DE MACARRONES receta foto
333,PIZZAS DE ESPINACAS Y QUESO,pizzas-de-espinacas-y-queso,Pastas y masas,482,0333-pizzas-de-espinacas-y-queso.webp,PIZZAS DE ESPINACAS Y QUESO receta foto
334,PIZZA CON HUEVO FRITO Y RÚCULA,pizza-con-huevo-frito-y-rucula,Pastas y masas,483,0334-pizza-con-huevo-frito-y-rucula.webp,PIZZA CON HUEVO FRITO Y RÚCULA receta foto
337,AREPAS VENEZOLANAS,arepas-venezolanas,Pastas y masas,488,0337-arepas-venezolanas.webp,AREPAS VENEZOLANAS receta foto
338,"PASTA CON MORCILLA, SALSA DE MAÍZ Y HUEVO ESCALFADO",pasta-con-morcilla-salsa-de-maiz-y-huevo-escalfado,Pastas y masas,489,0338-pasta-con-morcilla-salsa-de-maiz-y-huevo-escalfado.webp,"PASTA CON MORCILLA, SALSA DE MAÍZ Y HUEVO ESCALFADO receta foto"
339,TALLARINES CON VERDURAS Y SARDINA VIEJA,tallarines-con-verduras-y-sardina-vieja,Pastas y masas,490,0339-tallarines-con-verduras-y-sardina-vieja.webp,TALLARINES CON VERDURAS Y SARDINA VIEJA receta foto
340,TALLARINES CON VERDURAS Y SALSA PESTO,tallarines-con-verduras-y-salsa-pesto,Pastas y masas,491,0340-tallarines-con-verduras-y-salsa-pesto.webp,TALLARINES CON VERDURAS Y SALSA PESTO receta foto
343,CANELONES RELLENOS DE PAVO Y ESPÁRRAGOS VERDES,canelones-rellenos-de-pavo-y-esparragos-verdes,Pastas y masas,497,0343-canelones-rellenos-de-pavo-y-esparragos-verdes.webp,CANELONES RELLENOS DE PAVO Y ESPÁRRAGOS VERDES receta foto
344,"MACARRONES CON BEICON, ESPINACAS Y SALSA MORNAY",macarrones-con-beicon-espinacas-y-salsa-mornay,Pastas y masas,498,0344-macarrones-con-beicon-espinacas-y-salsa-mornay.webp,"MACARRONES CON BEICON, ESPINACAS Y SALSA MORNAY receta foto"
345,ESPIRALES DE COLORES CON CONEJO,espirales-de-colores-con-conejo,Pastas y masas,499,0345-espirales-de-colores-con-conejo.webp,ESPIRALES DE COLORES CON CONEJO receta foto
346,CANELONES DE RAPE CON VERDURAS,canelones-de-rape-con-verduras,Pastas y masas,500,0346-canelones-de-rape-con-verduras.webp,CANELONES DE RAPE CON VERDURAS receta foto
349,PIZZA DE ESPINACAS Y CHORIZO,pizza-de-espinacas-y-chorizo,Pastas y masas,506,0349-pizza-de-espinacas-y-chorizo.webp,PIZZA DE ESPINACAS Y CHORIZO receta foto
350,PASTA VERDE PICANTE CON SALMÓN,pasta-verde-picante-con-salmon,Pastas y masas,507,0350-pasta-verde-picante-con-salmon.webp,PASTA VERDE PICANTE CON SALMÓN receta foto
351,MACARRONES CON POLLO AL CURRY,macarrones-con-pollo-al-curry,Pastas y masas,508,0351-macarrones-con-pollo-al-curry.webp,MACARRONES CON POLLO AL CURRY receta foto
352,ESPAGUETIS CON PAVO Y SETAS,espaguetis-con-pavo-y-setas,Pastas y masas,509,0352-espaguetis-con-pavo-y-setas.webp,ESPAGUETIS CON PAVO Y SETAS receta foto
355,"PASTA FRESCA CON JAMÓN, CALABACÍN Y QUESO",pasta-fresca-con-jamon-calabacin-y-queso,Pastas y masas,514,0355-pasta-fresca-con-jamon-calabacin-y-queso.webp,"PASTA FRESCA CON JAMÓN, CALABACÍN Y QUESO receta foto"
356,MACARRONES CON TOMATE Y PAVO CURADO,macarrones-con-tomate-y-pavo-curado,Pastas y masas,515,0356-macarrones-con-tomate-y-pavo-curado.webp,MACARRONES CON TOMATE Y PAVO CURADO receta foto
357,FIDEOS CON CABALLA EN TOMATE,fideos-con-caballa-en-tomate,Pastas y masas,516,0357-fideos-con-caballa-en-tomate.webp,FIDEOS CON CABALLA EN TOMATE receta foto
358,"RAVIOLIS DE CALABAZA, JAMÓN Y RICOTA",raviolis-de-calabaza-jamon-y-ricota,Pastas y masas,517,0358-raviolis-de-calabaza-jamon-y-ricota.webp,"RAVIOLIS DE CALABAZA, JAMÓN Y RICOTA receta foto"
360,CANELONES DE CALABACÍN Y QUESO DE CABRA,canelones-de-calabacin-y-queso-de-cabra,Pastas y masas,520,0360-canelones-de-calabacin-y-queso-de-cabra.webp,CANELONES DE CALABACÍN Y QUESO DE CABRA receta foto
361,PIZZA PICANTE DE PAVO Y PIÑA,pizza-picante-de-pavo-y-pina,Pastas y masas,521,0361-pizza-picante-de-pavo-y-pina.webp,PIZZA PICANTE DE PAVO Y PIÑA receta foto
364,"LASAÑA DE ESPINACAS, PAVO Y CALABACÍN",lasana-de-espinacas-pavo-y-calabacin,Pastas y masas,529,0364-lasana-de-espinacas-pavo-y-calabacin.webp,"LASAÑA DE ESPINACAS, PAVO Y CALABACÍN receta foto"
365,CANELONES DE MEJILLONES CON BECHAMEL DE CALABAZA,canelones-de-mejillones-con-bechamel-de-calabaza,Pastas y masas,530,0365-canelones-de-mejillones-con-bechamel-de-calabaza.webp,CANELONES DE MEJILLONES CON BECHAMEL DE CALABAZA receta foto
366,FIDEOS CON COSTILLA Y MAYONESA DE AJO NEGRO,fideos-con-costilla-y-mayonesa-de-ajo-negro,Pastas y masas,531,0366-fideos-con-costilla-y-mayonesa-de-ajo-negro.webp,FIDEOS CON COSTILLA Y MAYONESA DE AJO NEGRO receta foto
367,ESPAGUETIS CON BRÓCOLI,espaguetis-con-brocoli,Pastas y masas,532,0367-espaguetis-con-brocoli.webp,ESPAGUETIS CON BRÓCOLI receta foto
370,TALLARINES A LA CARBONARA,tallarines-a-la-carbonara,Pastas y masas,538,0370-tallarines-a-la-carbonara.webp,TALLARINES A LA CARBONARA receta foto
371,LASAÑA DE ALCACHOFAS CON JAMÓN,lasana-de-alcachofas-con-jamon,Pastas y masas,539,0371-lasana-de-alcachofas-con-jamon.webp,LASAÑA DE ALCACHOFAS CON JAMÓN receta foto
372,PIZZA GRANJERA,pizza-granjera,Pastas y masas,540,0372-pizza-granjera.webp,PIZZA GRANJERA receta foto
373,MACARRONES CON ESPÁRRAGOS VERDES Y JAMÓN,macarrones-con-esparragos-verdes-y-jamon,Pastas y masas,541,0373-macarrones-con-esparragos-verdes-y-jamon.webp,MACARRONES CON ESPÁRRAGOS VERDES Y JAMÓN receta foto
375,VOLOVANES CON VERDURAS Y SALSA DE CALABACÍN,volovanes-con-verduras-y-salsa-de-calabacin,Pastas y masas,545,0375-volovanes-con-verduras-y-salsa-de-calabacin.webp,VOLOVANES CON VERDURAS Y SALSA DE CALABACÍN receta foto
376,EMPANADILLAS DE ALMEJAS Y BRÓCOLI,empanadillas-de-almejas-y-brocoli,Pastas y masas,546,0376-empanadillas-de-almejas-y-brocoli.webp,EMPANADILLAS DE ALMEJAS Y BRÓCOLI receta foto
378,TORTITAS DE PAVO Y CHAMPIÑONES,tortitas-de-pavo-y-champinones,Pastas y masas,549,0378-tortitas-de-pavo-y-champinones.webp,TORTITAS DE PAVO Y CHAMPIÑONES receta foto
379,CREPES DE CHAMPIÑONES CON SALSA DE ALBAHACA,crepes-de-champinones-con-salsa-de-albahaca,Pastas y masas,550,0379-crepes-de-champinones-con-salsa-de-albahaca.webp,CREPES DE CHAMPIÑONES CON SALSA DE ALBAHACA receta foto
381,RELÁMPAGOS SALADOS,relampagos-salados,Pastas y masas,554,0381-relampagos-salados.webp,RELÁMPAGOS SALADOS receta foto
382,CANUTILLOS DE PASTEL DE PESCADO,canutillos-de-pastel-de-pescado,Pastas y masas,555,0382-canutillos-de-pastel-de-pescado.webp,CANUTILLOS DE PASTEL DE PESCADO receta foto
385,EMPANADILLAS DE SETAS Y BACALAO AHUMADO,empanadillas-de-setas-y-bacalao-ahumado,Pastas y masas,561,0385-empanadillas-de-setas-y-bacalao-ahumado.webp,EMPANADILLAS DE SETAS Y BACALAO AHUMADO receta foto
386,TARTALETAS DE ENSALADILLA RUSA,tartaletas-de-ensaladilla-rusa,Pastas y masas,561,0386-tartaletas-de-ensaladilla-rusa.webp,TARTALETAS DE ENSALADILLA RUSA receta foto
387,VOLOVANES DE ACELGAS CON SALSA BAGNA CAUDA,volovanes-de-acelgas-con-salsa-bagna-cauda,Pastas y masas,563,0387-volovanes-de-acelgas-con-salsa-bagna-cauda.webp,VOLOVANES DE ACELGAS CON SALSA BAGNA CAUDA receta foto
388,MINITARTALETAS VARIADAS,minitartaletas-variadas,Pastas y masas,564,0388-minitartaletas-variadas.webp,MINITARTALETAS VARIADAS receta foto
390,PAN DE JAMÓN CON QUESO Y ACEITUNAS ALIÑADAS,pan-de-jamon-con-queso-y-aceitunas-alinadas,Pastas y masas,568,0390-pan-de-jamon-con-queso-y-aceitunas-alinadas.webp,PAN DE JAMÓN CON QUESO Y ACEITUNAS ALIÑADAS receta foto
391,CREPES DE JAMÓN Y QUESO CON SALSA DE FRAMBUESAS,crepes-de-jamon-y-queso-con-salsa-de-frambuesas,Pastas y masas,569,0391-crepes-de-jamon-y-queso-con-salsa-de-frambuesas.webp,CREPES DE JAMÓN Y QUESO CON SALSA DE FRAMBUESAS receta foto
393,EMPANADA DE BACALAO,empanada-de-bacalao,Pastas y masas,572,0393-empanada-de-bacalao.webp,EMPANADA DE BACALAO receta foto
394,OVNIS DE MORCILLA Y MANZANA CON PURÉ DE BERZA,ovnis-de-morcilla-y-manzana-con-pure-de-berza,Pastas y masas,573,0394-ovnis-de-morcilla-y-manzana-con-pure-de-berza.webp,OVNIS DE MORCILLA Y MANZANA CON PURÉ DE BERZA receta foto
396,CREPES DE PAVO Y QUESO,crepes-de-pavo-y-queso,Pastas y masas,577,0396-crepes-de-pavo-y-queso.webp,CREPES DE PAVO Y QUESO receta foto
397,MILHOJAS DE CHAMPIÑONES,milhojas-de-champinones,Pastas y masas,578,0397-milhojas-de-champinones.webp,MILHOJAS DE CHAMPIÑONES receta foto
399,QUICHE DE PUERROS Y GAMBAS,quiche-de-puerros-y-gambas,Pastas y masas,582,0399-quiche-de-puerros-y-gambas.webp,QUICHE DE PUERROS Y GAMBAS receta foto
400,"BRAZO DE GITANO RELLENO DE PAVO, SETAS Y QUESO",brazo-de-gitano-relleno-de-pavo-setas-y-queso,Pastas y masas,583,0400-brazo-de-gitano-relleno-de-pavo-setas-y-queso.webp,"BRAZO DE GITANO RELLENO DE PAVO, SETAS Y QUESO receta foto"
402,PASTEL DE REMOLACHA Y ESPÁRRAGOS VERDES,pastel-de-remolacha-y-esparragos-verdes,Pastas y masas,587,0402-pastel-de-remolacha-y-esparragos-verdes.webp,PASTEL DE REMOLACHA Y ESPÁRRAGOS VERDES receta foto
403,COQUES A LA CALFÓ,coques-a-la-calfo,Pastas y masas,588,0403-coques-a-la-calfo.webp,COQUES A LA CALFÓ receta foto
405,"EMPANADA DE MORCILLA, CALABAZA Y MANZANA",empanada-de-morcilla-calabaza-y-manzana,Pastas y masas,592,0405-empanada-de-morcilla-calabaza-y-manzana.webp,"EMPANADA DE MORCILLA, CALABAZA Y MANZANA receta foto"
406,"CREPES RELLENOS DE BERENJENA, QUESO Y PAVO",crepes-rellenos-de-berenjena-queso-y-pavo,Pastas y masas,593,0406-crepes-rellenos-de-berenjena-queso-y-pavo.webp,"CREPES RELLENOS DE BERENJENA, QUESO Y PAVO receta foto"
409,"VOLOVANES DE AJOS FRESCOS, CHAMPIÑONES Y GAMBAS",volovanes-de-ajos-frescos-champinones-y-gambas,Pastas y masas,599,0409-volovanes-de-ajos-frescos-champinones-y-gambas.webp,"VOLOVANES DE AJOS FRESCOS, CHAMPIÑONES Y GAMBAS receta foto"
410,EMPANADA DE ISCOS,empanada-de-iscos,Pastas y masas,599,0410-empanada-de-iscos.webp,EMPANADA DE ISCOS receta foto
412,CREPES DE PUERRO Y QUESO,crepes-de-puerro-y-queso,Pastas y masas,603,0412-crepes-de-puerro-y-queso.webp,CREPES DE PUERRO Y QUESO receta foto
413,TARTALETAS DE AVENA CON VERDURAS Y QUESO,tartaletas-de-avena-con-verduras-y-queso,Pastas y masas,604,0413-tartaletas-de-avena-con-verduras-y-queso.webp,TARTALETAS DE AVENA CON VERDURAS Y QUESO receta foto
414,MACARRONES A LA BOLOÑESA,macarrones-a-la-bolonesa,Pastas y masas,605,0414-macarrones-a-la-bolonesa.webp,MACARRONES A LA BOLOÑESA receta foto
416,FIDEOS CON VERDURAS Y COSTILLA DE CERDO,fideos-con-verduras-y-costilla-de-cerdo,Pastas y masas,609,0416-fideos-con-verduras-y-costilla-de-cerdo.webp,FIDEOS CON VERDURAS Y COSTILLA DE CERDO receta foto
418,SOPA DE ARROZ CON ALMEJAS,sopa-de-arroz-con-almejas,Sopas y cremas,614,0418-sopa-de-arroz-con-almejas.webp,SOPA DE ARROZ CON ALMEJAS receta foto
419,SOPA DE OTOÑO,sopa-de-otono,Sopas y cremas,615,0419-sopa-de-otono.webp,SOPA DE OTOÑO receta foto
421,CREMA DE ACELGAS CON CROQUETAS DE MIJO,crema-de-acelgas-con-croquetas-de-mijo,Sopas y cremas,619,0421-crema-de-acelgas-con-croquetas-de-mijo.webp,CREMA DE ACELGAS CON CROQUETAS DE MIJO receta foto
422,CREMA DE MEJILLONES CON HOJALDRE,crema-de-mejillones-con-hojaldre,Sopas y cremas,620,0422-crema-de-mejillones-con-hojaldre.webp,CREMA DE MEJILLONES CON HOJALDRE receta foto
425,CREMA DE CHAMPIÑÓN CON BUÑUELOS,crema-de-champinon-con-bunuelos,Sopas y cremas,625,0425-crema-de-champinon-con-bunuelos.webp,CREMA DE CHAMPIÑÓN CON BUÑUELOS receta foto
426,SOPA MARINERA CON TAPIOCA,sopa-marinera-con-tapioca,Sopas y cremas,627,0426-sopa-marinera-con-tapioca.webp,SOPA MARINERA CON TAPIOCA receta foto
427,SOPA JAPONESA,sopa-japonesa,Sopas y cremas,628,0427-sopa-japonesa.webp,SOPA JAPONESA receta foto
428,SOPA DE POLLO CON VERDURAS Y PESTO,sopa-de-pollo-con-verduras-y-pesto,Sopas y cremas,628,0428-sopa-de-pollo-con-verduras-y-pesto.webp,SOPA DE POLLO CON VERDURAS Y PESTO receta foto
431,CREMA DE LENTEJAS CON TEMPURA DE ZAHAHORIAS Y AJOS FRESCOS,crema-de-lentejas-con-tempura-de-zahahorias-y-ajos-frescos,Sopas y cremas,635,0431-crema-de-lentejas-con-tempura-de-zahahorias-y-ajos-frescos.webp,CREMA DE LENTEJAS CON TEMPURA DE ZAHAHORIAS Y AJOS FRESCOS receta foto
432,CREMA DE CALABACÍN CON HIGOS SALTEADOS Y PALITOS DE SÉSAMO,crema-de-calabacin-con-higos-salteados-y-palitos-de-sesamo,Sopas y cremas,636,0432-crema-de-calabacin-con-higos-salteados-y-palitos-de-sesamo.webp,CREMA DE CALABACÍN CON HIGOS SALTEADOS Y PALITOS DE SÉSAMO receta foto
433,CREMA DE ALUBIAS CON RAVIOLIS DE MORCILLA,crema-de-alubias-con-raviolis-de-morcilla,Sopas y cremas,637,0433-crema-de-alubias-con-raviolis-de-morcilla.webp,CREMA DE ALUBIAS CON RAVIOLIS DE MORCILLA receta foto
434,CREMA DE PUERROS CON BUÑUELOS DE MAÍZ,crema-de-puerros-con-bunuelos-de-maiz,Sopas y cremas,638,0434-crema-de-puerros-con-bunuelos-de-maiz.webp,CREMA DE PUERROS CON BUÑUELOS DE MAÍZ receta foto
436,SOPA DE PICADILLO,sopa-de-picadillo,Sopas y cremas,642,0436-sopa-de-picadillo.webp,SOPA DE PICADILLO receta foto
